publishedAt,source_id,source_name,category,language,country,author,title,description,url,sentiment_score,title_eng,description_eng
2024-10-08T07:50:44Z,abc-news,ABC News,general,en,us,"DANIEL NIEMANN Associated Press, MIKE CORDER Associated Press",Nobel Prize in physics awarded to two scientists for machine learning discoveries,John Hopfield and Geoffrey Hinton have been awarded the Nobel Prize in physics for discoveries and inventions that formed the building blocks of machine learning,https://abcnews.go.com/International/wireStory/nobel-prize-physics-awarded-day-after-2-americans-114587561,,,
2024-10-08T07:06:06Z,abc-news,ABC News,general,en,us,Jon Haworth,"US Marshals arrest man 5 months after he allegedly shot somebody in the head, set them on fire","Michael Hurley, 37, had been wanted in Ohio for aggravated murder since May.",https://abcnews.go.com/US/us-marshals-arrest-man-5-months-after-allegedly/story?id=114586967,,,
2024-10-08T06:38:09Z,abc-news,ABC News,general,en,us,Jon Haworth,40-year-old man falls 200 feet to his death while canyoneering at national park,The man was hiking with three others through Heaps Canyon when he fell.,https://abcnews.go.com/US/40-year-man-falls-200-feet-death-canyoneering/story?id=114586730,,,
2024-10-08T03:29:00Z,abc-news,ABC News,general,en,us,Jolie Lash,3 dead in medical helicopter crash,The three were on their way to pick up a patient when the incident happened.,https://abcnews.go.com/US/3-dead-medical-helicopter-crash/story?id=114584811,,,
2024-10-08T01:25:00Z,abc-news,ABC News,general,en,us,"Will McDuffie, Gabriella Abdul-Hakim, Fritz Farrow","Harris, pressed on how she’d get economic plan through Congress, suggests there might be a path","Harris has proposed tax credits, including for parents and first-time homebuyers",https://abcnews.go.com/Politics/harris-pressed-shed-economic-plan-congress-suggests-path/story?id=114565146,,,
2024-10-07T22:43:00Z,abc-news,ABC News,general,en,us,"Deena Zaru, Tesfaye Negussie",Former officer convicted in Tyre Nichols' death to be held without bond until sentencing,The two other former Memphis officers are allowed to be on supervised release.,https://abcnews.go.com/US/former-officer-convicted-tyre-nichols-death-held-bond/story?id=114560040,,,
2024-10-07T22:29:30Z,abc-news,ABC News,general,en,us,Shannon K. Kingston,"After a year of war in Gaza, American diplomacy proves futile so far: ANALYSIS",Experts say failure to resolve the conflict will have lasting effects for U.S.,https://abcnews.go.com/Politics/after-year-war-gaza-american-diplomacy-proves-futile-analysis/story?id=114558519,,,
2024-10-07T22:02:57Z,abc-news,ABC News,general,en,us,MORGAN LEE Associated Press,Movie armorer on Alec Baldwin's film 'Rust' pleads guilty to gun charge in separate case,She pleaded guilty to carrying a gun into a license liquor establishment.,https://abcnews.go.com/US/wireStory/movie-armorer-alec-baldwins-film-rust-pleads-guilty-114579606,,,
2024-10-07T21:51:07Z,abc-news,ABC News,general,en,us,BRUCE SHIPKOWSKI Associated Press,"American Water, largest water utility in US, dealing with cyberattack","American Water serves 14 million people in 14 states, 18 military installations.",https://abcnews.go.com/Technology/wireStory/american-water-largest-water-utility-us-dealing-cyberattack-114579099,,,
2024-10-07T19:10:00Z,abc-news,ABC News,general,en,us,"Jay O'Brien, Julia Reinstein",Florida Gov. Ron DeSantis refuses call from VP Kamala Harris ahead of Hurricane Milton: Source,"DeSantis believed the call was politically motivated, a source said.",https://abcnews.go.com/US/florida-gov-ron-desantis-refuses-call-vp-kamala/story?id=114570089,,,
2024-11-29T11:49:18Z,abc-news-au,ABC News (AU),general,en,au,ABC News,"Chinese journalist Dong Yuyu sentenced to seven years in prison for spying, prompting outcry",Dong Yuyu has been published in several international publications and is well-respected around the world.,https://www.abc.net.au/news/2024-11-29/chinese-journalist-dong-yuyu-jailed-for-espionage/104667352,,,
2024-11-29T09:26:31Z,abc-news-au,ABC News (AU),general,en,au,Andi Yu,"Peter Garrett no longer leading MSO review, orchestra undergoes board overhaul",The orchestra says the former Midnight Oil frontman and ex-arts minister has cancelled his leadership of its review because of other commitments.,https://www.abc.net.au/news/2024-11-29/peter-garrett-mso-review-ceo-richard-wigley/104667092,,,
2024-11-29T04:59:39Z,abc-news-au,ABC News (AU),general,en,au,Annika Burgess,Russia is unleashing record drone attacks on Ukraine with foam decoys and new Shahed warheads,"Russia is carrying out record mass drone attacks on Ukraine, and experts say its new foam decoys and thermobaric warheads were making them more devastating and difficult to defend against.",https://www.abc.net.au/news/2024-11-29/russia-largest-drone-strike-foam-gerbera-/104652372,,,
2024-11-29T04:51:38Z,abc-news-au,ABC News (AU),general,en,au,ABC News,"Crew mistakes caused the sinking of a New Zealand navy ship off Samoan coast, inquiry finds","Mistakes by members of the crew caused a New Zealand navy ship to plough into a reef off the coast of Samoa, where it caught fire and sank, according to the preliminary findings of a military Court of Inquiry.",https://www.abc.net.au/news/2024-11-29/crew-mistakes-caused-new-zealand-navy-sinking-off-samoa/104665376,,,
2024-11-29T03:46:42Z,abc-news-au,ABC News (AU),general,en,au,Lauren Day,Australians urged to avoid Tiger Vodka and Tiger Whisky due to 'safety concerns' after methanol poisoning in Laos,"Australian government website Smartraveller has issued a fresh warning about drinking in Laos, urging Australians to avoid Tiger Vodka and Tiger Whisky, due to ""serious safety concerns"".",https://www.abc.net.au/news/2024-11-29/smartraveller-warns-against-drinking-tiger-vodka-in-laos/104655210,,,
2024-11-29T03:38:32Z,abc-news-au,ABC News (AU),general,en,au,Jacob Greber,Renegade senator Fatima Payman delivers ‘oh shit’ moment for prime minister on green overhaul,Fatima Payman's vote was needed to pass a critical reform. It was late on Wednesday the prime minister's office realised it was about to collapse.,https://www.abc.net.au/news/2024-11-29/fatima-payman-helped-sink-key-environmental-laws/104664940,,,
2024-11-29T02:28:25Z,abc-news-au,ABC News (AU),general,en,au,Eden Gillespie,Notorious daycare paedophile Ashley Paul Griffith sentenced to life in prison for abusing children in Australia and Italy,Former childcare worker Ashley Paul Griffith pleaded guilty in September to more than 300 charges against 69 children in early learning centres in Brisbane and Italy over almost two decades.,https://www.abc.net.au/news/2024-11-29/daycare-paedophile-ashley-paul-griffith-sentencing/104663114,,,
2024-11-29T02:15:53Z,abc-news-au,ABC News (AU),general,en,au,Jessica Kidd,Three men sentenced over gang rape in Airbnb during Newcastle bucks party,"Three men from Sydney have been sentenced to prison over their sexual assaults against three women in their late teens, with the longest term being 14 years.",https://www.abc.net.au/news/2024-11-29/women-raped-newcastle-bucks-party-men-sentenced-in-court/104662672,,,
2024-11-29T00:02:50Z,abc-news-au,ABC News (AU),general,en,au,Jake Evans,More than 30 Australian laws changed overnight. Here's what's new,"There are new laws for supermarkets, housing developers, victims of sexual violence, the Reserve Bank and many more, after the government ticked off dozens of items on its to-do list in a single night.",https://www.abc.net.au/news/2024-11-29/australian-laws-changed-overnight-whats-new/104662602,,,
2024-11-28T18:39:46Z,abc-news-au,ABC News (AU),general,en,au,Riley Stuart,Australia's social media ban for kids makes global headlines as some news outlets ask if their country could be next,"Australia's social media ban for children makes headlines around the world, including as far away as Russia, as articles question how it could work and whether similar laws would be introduced elsewhere.",https://www.abc.net.au/news/2024-11-29/australia-social-media-ban-for-kids-makes-global-headlines/104662426,,,
2020-07-09T05:07:28.1117533Z,aftenposten,Aftenposten,general,no,no,NTB-AFP-DPA,Russisk resolusjonsforslag om Syria falt,"Et russisk resolusjonsforslag i FNs sikkerhetsråd om å redusere nødhjelp over grensen til Syria, har falt.",https://www.aftenposten.no/verden/i/AdjaEM/Russisk-resolusjonsforslag-om-Syria-falt,,,
2020-07-09T05:07:26.8308217Z,aftenposten,Aftenposten,general,no,no,NTB-TT,"Kina og USA stadig nærmere klinsj i Sør-Kina-havet, mener eksperter","Kinas militærøvelser i Sør-Kina-havet møtes med kritikk fra USA, som selv viser muskler i regionen. Eksperter mener de to er stadig nærmere militær konflikt.",https://www.aftenposten.no/verden/i/LAJzkQ/Kina-og-USA-stadig-narmere-klinsj-i-Sor-Kina-havet_-mener-eksperter,,,
2020-07-09T05:07:25.190605Z,aftenposten,Aftenposten,general,no,no,NTB-AP-AFP,"Oberstløytnant som vitnet mot Trump, går av","Oberstløytnant Alexander Vindman, som vitnet mot president Donald Trump i riksrettssaken, orker ikke mer mobbing og trekker seg fra hæren.",https://www.aftenposten.no/verden/i/y3QoOK/Oberstloytnant-som-vitnet-mot-Trump_-gar-av,,,
2020-07-09T05:07:23.894053Z,aftenposten,Aftenposten,general,no,no,NTB-Johan Falnes,Tik Tok installert på flere mobiler i regjeringen,USA frykter at brukerdata fra Tik Tok kan bli overført til Kina. I Norge har flere i regjeringen lastet ned appen – inkludert statsminister Erna Solberg.,https://www.aftenposten.no/norge/politikk/i/jdo5Le/Tik-Tok-installert-pa-flere-mobiler-i-regjeringen,,,
2020-07-09T05:07:20.1293643Z,aftenposten,Aftenposten,general,no,no,Aftenposten,Direkteblogg om korona,Følg utviklingen her.,https://www.aftenposten.no/verden/i/pL54lE/Direktestudio-Koronaviruset,,,
2020-07-09T04:04:47Z,aftenposten,Aftenposten,general,no,no,NTB-DPA,George Floyd ropte 21 ganger at han ikke kunne puste,21 ganger ropte George Floyd at han ikke kunne puste før han døde. Det viser nye utskrifter fra opptakene fra politimennenes kroppskameraer.,https://www.aftenposten.no/verden/i/qLGok0/George-Floyd-ropte-21-ganger-at-han-ikke-kunne-puste,,,
2020-07-09T03:34:16Z,aftenposten,Aftenposten,general,no,no,Marianne Stensland,"Steriliseringsmetoden har resultert i over 33.000 søksmål. I Norge er metoden stoppet, men pasienter blir ikke informert.","Etter at Kjerstin Bakkevoll fikk satt inn et implantat for å bli steril, fikk hun sterke fysiske plager. I Norge brukes ikke lenger implantatet, men norske pasienter får ingen informasjon.",https://www.aftenposten.no/norge/i/8meo7W/Steriliseringsmetoden-har-resultert-i-over-33000-soksmal-I-Norge-er-metoden-stoppet_-men-pasienter-blir-ikke-informert,,,
2020-07-08T17:24:44Z,aftenposten,Aftenposten,general,no,no,Per Anders Johansen,Europa åpnet grensene i juni. Nye tall forteller hvor mange som ble smittet.,"Noen dager før regjeringen skal bestemme hvilke land nordmenn karantenefritt kan reise til i sommer, ligger en rekke land godt an. Åpning av grensene i Europa i juni har gitt «ubetydelig» importsmitte, ifølge det europeiske smittevernbyrået.",https://www.aftenposten.no/norge/i/Vb0aw3/Europa-apnet-grensene-i-juni-Nye-tall-viser-hvor-mange-som-ble-smittet,,,
2020-07-08T14:11:28Z,aftenposten,Aftenposten,general,no,no,"Mone Celin Skrede, Robert Gjerde","Prinsesse Ingrid Alexandra bor i Viken, men skal gå på skole i Oslo. Hvordan kan det ha seg?","Mandag ble det klart at prinsesse Ingrid Alexandra skal begynne på Elvebakken videregående skole i Oslo til høsten, selv om hun er bosatt i Viken. Slottet oppgir at hun kom inn på ordinære vilkår.",https://www.aftenposten.no/norge/i/6jxQXO/Prinsesse-Ingrid-Alexandra-bor-i-Viken_-men-skal-ga-pa-skole-i-Oslo-Hvordan-kan-det-ha-seg,,,
2020-07-07T10:08:33Z,aftenposten,Aftenposten,general,no,no,Julie Berg Melfald,Over 600 tyske soldater etterforskes for høyreekstremisme. Nå har spesialstyrkene til oktober å rydde opp i eget hus.,48.000 patroner og 62 kilo med eksplosiver har forsvunnet fra våpenlagrene til tyske spesialstyrker. Tyske myndigheter er bekymret.,https://www.aftenposten.no/verden/i/WbnKoj/Over-600-tyske-soldater-etterforskes-for-hoyreekstremisme-Na-har-spesialstyrkene-til-oktober-a-rydde-opp-i-eget-hus,,,
2024-11-29T12:28:03Z,al-jazeera-english,Al Jazeera English,general,en,us,Al Jazeera,South Africa’s police minister promises to clamp down on illegal mining,"In an interview with Al Jazeera, Senzo Mchunu says they don’t know how many people remain trapped in Stilfontein mine.",https://www.aljazeera.com/news/2024/11/29/south-africas-police-minister-vows-to-clamp-down-on-illegal-mining,,,
2024-11-29T11:59:11Z,al-jazeera-english,Al Jazeera English,general,en,us,Al Jazeera,Restored Notre-Dame Cathedral in Paris unveiled after 2019 fire,"Macron inspects results of 700-million-euro restoration, including 19th-century Gothic spire returned to former glory.",https://www.aljazeera.com/news/2024/11/29/restored-notre-dame-cathedral-in-paris-unveiled-after-2019-fire,,,
2024-11-29T11:43:19Z,al-jazeera-english,Al Jazeera English,general,en,us,Niko Vorobyov,‘Most dangerous stage’: The view from Russia as Ukraine war escalates,Officials rage at the West for allowing Ukraine to attack deep within Russia as fears simmer on the streets.,https://www.aljazeera.com/news/2024/11/29/view-from-russia-ukraine-escalation,,,
2024-11-29T10:36:59Z,al-jazeera-english,Al Jazeera English,general,en,us,Al Jazeera,UK MPs face crucial vote on divisive assisted dying bill,Many politicians are still undecided on whether the terminally ill should be allowed to end their lives.,https://www.aljazeera.com/news/2024/11/29/uk-lawmakers-face-crucial-vote-on-divisive-assisted-dying-bill,,,
2024-11-29T10:04:19Z,al-jazeera-english,Al Jazeera English,general,en,us,Al Jazeera,"Iran plans to install 6,000 centrifuges to enrich uranium, IAEA says",UN nuclear watchdog’s report comes as Iran prepares to hold talks with European nations over its nuclear programme.,https://www.aljazeera.com/news/2024/11/29/iran-plans-to-install-6000-centrifuges-to-enrich-uranium-iaea-says,,,
2024-11-29T09:23:14Z,al-jazeera-english,Al Jazeera English,general,en,us,Al Jazeera,Ireland votes in close-run election dominated by housing crisis,Polls show centre-right incumbents Fine Gael and Fianna Fail running neck and neck with leftist-nationalist Sinn Fein.,https://www.aljazeera.com/news/2024/11/29/ireland-votes-in-close-run-election-dominated-by-housing-crisis,,,
2024-11-29T08:21:43Z,al-jazeera-english,Al Jazeera English,general,en,us,Mat Nashed,Lebanon’s displaced wrestle with grief and despair as they return home,Lebanon’s displaced families are relieved the war with Israel is over and are now picking up the pieces of their lives.,https://www.aljazeera.com/features/2024/11/29/lebanons-displaced-wrestle-with-grief-and-despair-as-they-return-home,,,
2024-11-29T08:05:52Z,al-jazeera-english,Al Jazeera English,general,en,us,Erin Hale,Cars to fruit: The goods set to get pricier under Trump’s tariff plans,"US president-elect’s proposed tariffs on China, Canada and Mexico would raise the prices of numerous products.",https://www.aljazeera.com/economy/2024/11/29/cars-to-fruit-the-goods-set-to-get-pricier-under-trumps-tariff-plans,,,
2024-11-29T06:57:54Z,al-jazeera-english,Al Jazeera English,general,en,us,AJLabs,Which countries recognise Palestine in 2024?,"The State of Palestine is recognised as a sovereign nation by 146 countries, representing 75 percent of UN members.",https://www.aljazeera.com/news/2024/11/29/which-countries-recognise-palestine-in-2024,,,
2024-11-29T00:00:00Z,al-jazeera-english,Al Jazeera English,general,en,us,Alastair McCready,"LIVE: Israel kills 42 across Gaza, accused of truce violations in Lebanon",Israeli air strikes hammer Gaza as ceasefire in Lebanon continues to hold despite Israel accused of truce violations.,https://www.aljazeera.com/news/liveblog/2024/11/29/live-israel-kills-42-across-gaza-accused-of-truce-violations-in-lebanon,,,
2023-07-11T20:24:00Z,ansa,ANSA.it,general,it,it,ANSA.it,"Draghi, ora integrazione Ue attraverso un processo politico - Ultima Ora","L'ex presidente del consiglio ed ex presidente della Bce, Mario Draghi, chiede di accelerare l'integrazione Ue non più con un metodo ""tecnocratico"" come nel caso della nascita dell'euro che ""ha avuto successo"" ma attraverso un ""genuino processo politico do...…",http://www.ansa.it/sito/notizie/topnews/2023/07/11/draghi-ora-integrazione-ue-attraverso-un-processo-politico_12cd0724-fe48-4bac-b3fc-88f5e6cf5838.html,,,
2023-07-11T19:04:00Z,ansa,ANSA.it,general,it,it,ANSA.it,"Gb: strage su Tir con migranti, 13 anni di galera a un romeno - Ultima Ora",E' stato condannato a quasi 13 anni di carcere nel Regno Unito un cittadino romeno membro di una banda di trafficanti individuata come responsabile della strage di migranti clandestini vietnamiti morti soffocati in modo atroce nell'ottobre del 2019 nel gel...…,http://www.ansa.it/sito/notizie/topnews/2023/07/11/gb-strage-su-tir-con-migranti-13-anni-di-galera-a-un-romeno_b80a0fe3-8707-4ae4-b765-1f72e55604d2.html,,,
2023-07-11T17:32:00Z,ansa,ANSA.it,general,it,it,ANSA.it,"Meloni alla Nato, la coesione è l'arma più efficace - Ultima Ora","L'importanza del vertice che dà ""una nuova postura alla Nato"", l'approccio a ""360 gradi"" con l'attenzione da rivolgere al fianco Sud e in particolare all'Africa, anche per fronteggiare il fenomeno delle migrazioni, e ""lo straordinario sostegno all'Ucraina""...…",http://www.ansa.it/sito/notizie/topnews/2023/07/11/meloni-alla-nato-la-coesione-e-larma-piu-efficace_6a08cccd-6d8e-41a7-83ca-ce73e14910ac.html,,,
2023-07-11T17:24:00Z,ansa,ANSA.it,general,it,it,ANSA.it,"Ue, 'ricevuta richiesta di modifica Pnrr sulla quarta rata' - Ultima Ora","""Confermiamo di aver ricevuto la proposta di revisione mirata del piano dell'Italia, relativa a 10 misure nell'ambito della quarta richiesta di pagamento. (ANSA)",http://www.ansa.it/sito/notizie/topnews/2023/07/11/ue-ricevuta-richiesta-di-modifica-pnrr-sulla-quarta-rata_0a878089-0ee9-4b88-bc67-01f22ffc3fed.html,,,
2023-07-11T16:48:00Z,ansa,ANSA.it,general,it,it,ANSA.it,"Zelensky alla folla a Vilnius, 'Nato più forte con Kiev' - Ultima Ora","""La Nato renderà l'Ucraina più sicura e l'Ucraina renderà la Nato più forte"". Così il presidente ucraino Volodymyr Zelensky ha arringato la folla radunata per la manifestazione #UkraineNATO33 a Vilnius, a margine del vertice Nato nella capitale lituana. (ANSA)",http://www.ansa.it/sito/notizie/topnews/2023/07/11/zelensky-alla-folla-a-vilnius-nato-piu-forte-con-kiev_b68e42d1-1e74-4abb-9d21-24e58812c468.html,,,
2023-07-11T16:44:00Z,ansa,ANSA.it,general,it,it,ANSA.it,"Mit, 'impegnati affinché gli italiani non paghino scioperi' - Ultima Ora","Il ministero dei Trasporti e delle Infrastrutture, guidato da Matteo Salvini, ""farà di tutto affinché gli italiani non paghino troppo pesantemente la mobilitazione"". (ANSA)",http://www.ansa.it/sito/notizie/topnews/2023/07/11/mit-impegnati-affinche-gli-italiani-non-paghino-scioperi_6fbc8cb6-a3fc-469f-935f-4d9273e5ec50.html,,,
2023-07-11T16:34:00Z,ansa,ANSA.it,general,it,it,ANSA.it,"Fondazione per l'Arte Crt, Patrizia Sandretto presidente - Ultima Ora",Patrizia Sandretto Re Rebaudengo è la nuova presidente della Fondazione per l'Arte Moderna e Contemporanea Crt. (ANSA),http://www.ansa.it/sito/notizie/topnews/2023/07/11/fondazione-per-larte-crt-patrizia-sandretto-presidente_8b5cee9f-5094-49da-b787-46237559e692.html,,,
2023-07-11T16:31:00Z,ansa,ANSA.it,general,it,it,ANSA.it,"Mosca, potremmo usare bombe a grappolo se Kiev le avrà - Ultima Ora","""Se gli Stati Uniti forniscono munizioni a grappolo all'Ucraina, le forze armate russe saranno costrette a usare armi simili contro le forze armate ucraine come risposta"": lo ha detto il ministro della Difesa russo, Sergey Shoigu, citato dall'agenzia Interfax…",http://www.ansa.it/sito/notizie/topnews/2023/07/11/mosca-potremmo-usare-bombe-a-grappolo-se-kiev-le-avra_b84342de-10a1-4df9-ac6e-f37757566147.html,,,
2023-07-11T16:09:00Z,ansa,ANSA.it,general,it,it,ANSA.it,"Ok unanime del Senato al museo della Shoah a Roma, 157 sì - Ultima Ora",Via libera all'unanimità dall'Aula al Senato al ddl per l'istituzione del Museo della Shoah a Roma. I voti favorevoli sono stati 157. Presente in Aula il ministro della Cultura Gennaro Sangiuliano. Il provvedimento passa all'esame della Camera. (ANSA),http://www.ansa.it/sito/notizie/topnews/2023/07/11/ok-unanime-del-senato-al-museo-della-shoah-a-roma-157-si_5a074e33-8246-4dbc-9561-5092ca99b036.html,,,
2023-07-11T16:03:00Z,ansa,ANSA.it,general,it,it,ANSA.it,"Urso, 'se i prezzi dei voli non scendono interverremo' - Ultima Ora",Il ministero delle Imprese e del made in Italy Adolfo Urso è pronto a intervenire contro il caro-voli. (ANSA),http://www.ansa.it/sito/notizie/topnews/2023/07/11/urso-se-i-prezzi-dei-voli-non-scendono-interverremo_80c27007-c40d-400c-b403-51605b303c2a.html,,,
2024-11-29T19:07:35.3866653Z,bbc-sport,BBC Sport,sports,en,gb,,"Wales vs Republic of Ireland: Euro 2025 play-off final first leg - watch, listen & follow live","Watch, listen and follow live text commentary, plus score updates and match stats from Wales vs Republic of Ireland in their Euro 2025 qualifying play-off final first leg.",http://www.bbc.co.uk/sport/football/live/c4gm7dvpxrdt,,,
2024-11-29T19:07:23.8739045Z,bbc-sport,BBC Sport,sports,en,gb,,Qatar GP 2024: Lando Norris on sprint race pole ahead of Russell,McLaren’s Lando Norris takes pole position for the sprint race at the Qatar Grand Prix ahead of Mercedes driver George Russell.,http://www.bbc.co.uk/sport/formula1/articles/c7042014ze4o,,,
2024-11-29T18:37:21.7906017Z,bbc-sport,BBC Sport,sports,en,gb,,Ronaldinho scores brilliant free-kick for Barcelona against Real Madrid in legends El Clasico,"Brazilian footballing legend Ronaldinho scores a trademark free-kick for Barcelona against Real Madrid in a legends El Clasico match in Doha, Qatar.",http://www.bbc.co.uk/sport/football/videos/c5yx1ed4xdzo,,,
2024-11-29T18:37:18.8850761Z,bbc-sport,BBC Sport,sports,en,gb,,Chicago Bears: Matt Eberflus sacked as head coach after sixth straight defeat in NFL,The Chicago Bears sack head coach Matt Eberflus after suffering a sixth straight defeat.,http://www.bbc.co.uk/sport/american-football/articles/c4gzngpd87po,,,
2024-11-29T18:22:26.4471795Z,bbc-sport,BBC Sport,sports,en,gb,,Northern Ireland vs Norway: Uefa Women's Championship Qualifier,"Follow live text commentary, score updates and match stats from Northern Ireland vs Norway in the UEFA Women's Championship Qualification",http://www.bbc.co.uk/sport/football/live/cj0j6371vrgt,,,
2024-11-29T17:07:37.4964314Z,bbc-sport,BBC Sport,sports,en,gb,,Pep Guardiola: Manchester City boss says he has to prove himself amid poor form,"Manchester City boss Pep Guardiola says he wants to ""prove"" he can drag the club out of their current slump.",http://www.bbc.co.uk/sport/football/articles/c629py5dv6go,,,
2024-11-29T17:07:35.0595363Z,bbc-sport,BBC Sport,sports,en,gb,,Ilona Maher: American Olympic bronze medalist in line for Premiership move,American Olympic bronze medallist Ilona Maher could appear in this season's Premiership Women’s Rugby after the Rugby Football Union said it had supported her visa application.,http://www.bbc.co.uk/sport/rugby-union/articles/cx2nx8227g9o,,,
2024-11-29T17:07:23.4842924Z,bbc-sport,BBC Sport,sports,en,gb,,Novak Djokovic says Andy Murray partnership is a 'surprise' but 'exciting for tennis',"Novak Djokovic says his decision to appoint former rival Andy Murray as his coach was ""a surprise to everyone"" but is ""exciting for tennis"".",http://www.bbc.co.uk/sport/tennis/articles/cly2w09e4zro,,,
2024-11-29T12:52:25.5380723Z,bbc-sport,BBC Sport,sports,en,gb,,Liverpool v Man City: Key stats you need to know,10 key stats that suggest if Man City lose to Liverpool and slip 11 points behind in the Premier League title race - it could be over...,http://www.bbc.co.uk/sport/football/articles/c3rx5yvn3pdo,,,
2024-11-29T12:52:22.8043782Z,bbc-sport,BBC Sport,sports,en,gb,,New Zealand v England: Ollie Pope shows value through versatility,"Ollie Pope has been England's captain, vice-captain, keeper, opener, number three and number six. His value should not be underestimated, says Stephan Shemilt.",http://www.bbc.co.uk/sport/cricket/articles/c4gpnvd937qo,,,
2024-11-29T18:57:33Z,bild,Bild,general,de,de,Sarina Roocks,Tagesschau“ streicht „Damen und Herren“: Woke-Wahn oder überfällig? | Unterhaltung,"Woke-Wahnsinn oder längst überfällige Anpassung? Wie BILD exklusiv erfährt, schafft die „Tagesschau“ eine langjährige Tradition ab!",https://www.bild.de/unterhaltung/tv-fernsehformate/tagesschau-streicht-damen-und-herren-woke-wahn-oder-ueberfaellig-67499c926ee5aa76f748d426,,,
2024-11-29T18:52:28.2883233Z,bild,Bild,general,de,de,,Pandemie der Ungeimpften: Lauterbachs Corona-Lüge,Filip Piatov traf Karl Lauterbach und der Bundesgesundheitsminister ist mit einigen Aussagen und Fragen nicht einverstanden.,https://www.bild.de/politik/inland/pandemie-der-ungeimpften-lauterbach-geht-auf-bild-reporter-los-6749db3a299cd34e00bffcdb,,,
2024-11-29T18:44:36Z,bild,Bild,general,de,de,Michael Deutschmann,Sachsens Regierungskrise: Expertenregierung als Lösung? | Politik,"Matthias Berger schlägt eine Expertenregierung für Sachsen vor, um die aktuelle politische Pattsituation zu lösen.",https://www.bild.de/politik/inland/sachsens-regierungskrise-expertenregierung-als-loesung-6749d15a6ee5aa76f748d7e4,,,
