publishedAt,source_id,source_name,category,language,country,author,title,description,url,sentiment_score,title_eng,description_eng
2021-07-22T19:39:39Z,the-hindu,The Hindu,general,en,in,Special Correspondent,"Six Ministers huddle with Yediyurappa, but say they will abide by party decision",They had played a key role in bringing BJP to power,https://www.thehindu.com/news/national/karnataka/six-ministers-huddle-with-yediyurappa-but-say-they-will-abide-by-party-decision/article35480182.ece,,,
2021-07-22T18:32:00Z,the-hindu,The Hindu,general,en,in,The Hindu,Limits of cooperation: On reforms in cooperative sector,Reforms in cooperative sector should not be at the cost of federal principles,https://www.thehindu.com/opinion/editorial/limits-of-cooperation-the-hindu-editorial-on-reforms-in-cooperative-sector/article35478339.ece,,,
2021-07-22T18:32:00Z,the-hindu,The Hindu,general,en,in,The Hindu,In search of gold: On Tokyo Olympics,The Olympic Games remain the greatest sporting event for fans and athletes alike,https://www.thehindu.com/opinion/editorial/in-search-of-gold-the-hindu-editorial-on-tokyo-olympics-2021/article35478354.ece,,,
2021-07-22T17:18:05Z,the-hindu,The Hindu,general,en,in,Special Correspondent,"Hours after ouster as CBI chief, Alok Verma’s phone numbers made it to Pegasus list: Report","“Also added to the list of numbers at the same time as Verma were two other senior CBI officials, Rakesh Asthana and A.K. Sharma...,” news portal The Wire claimed in a report.",https://www.thehindu.com/news/national/hours-after-ouster-as-cbi-chief-alok-vermas-phone-numbers-made-it-to-pegasus-list-report/article35477226.ece,,,
2021-07-22T15:47:01Z,the-hindu,The Hindu,general,en,in,Ananth Krishnan,Dalai Lama’s close aides targeted on Pegasus spyware list,‘Analysis indicates that the Indian govt. was selecting the potential targets’,https://www.thehindu.com/news/international/dalai-lamas-close-aides-targeted-on-pegasus-spyware-list/article35474285.ece,,,
2021-07-22T12:45:50Z,the-hindu,The Hindu,general,en,in,Sobhana K Nair,"Parliament paralysed over Pegasus, farm laws",Trinamool member tears IT Minister’s statement on spyware.,https://www.thehindu.com/news/national/tmc-bjp-mps-scuffle-in-rajya-sabha-over-snooping/article35469208.ece,,,
2024-11-29T22:50:34Z,the-hill,The Hill,general,en,us,Juliann Ventura,Senate Democrat defends Vindman against Musk’s ‘treason’ threat,Sen. Tim Kaine (D-Va.) hit Elon Musk for suggesting in a post on his social platform X on Wednesday that retired Army Lt. Col Alexander Vindman “committed treason” and “will pay” after the former Trump impeachment witness accused the tech billionaire and clos…,https://thehill.com/homenews/senate/5015278-musk-kaine-vindman-treason/,,,
2024-11-29T22:02:59Z,the-hill,The Hill,general,en,us,Miranda Nazzaro,Jeffries calls threats against Connecticut Democrats ‘unconscionable’,House Minority Leader Hakeem Jeffries (D-N.Y.) denounced the recent bomb threats against several Connecticut Democrats as “unacceptable” and maintained House Democrats will not be intimidated from carrying out their jobs. “America is a democracy. Threats of v…,https://thehill.com/homenews/house/5015255-jeffries-calls-threats-against-connecticut-democrats-unconscionable/,,,
2024-11-29T19:11:57Z,the-hill,The Hill,general,en,us,Miranda Nazzaro,Amazon worker strike: 5 things to know,"Thousands of Amazon workers around the world went on strike Friday, demanding more pay and better working conditions during one of the retail giant’s busiest weekends of the year. The strike, dubbed “Make Amazon Pay,” has planned demonstrations in more than 2…",https://thehill.com/policy/technology/5014981-amazon-strike-workers-5-things/,,,
2024-11-29T17:15:00Z,the-hill,The Hill,general,en,us,Mike Lillis,Democrats sound alarm on West Bank under Trump administration,House Democrats are sounding early alarms that a second Trump administration will lead to a vast erosion of Palestinian rights and undermine efforts to bring peace to the volatile Middle East. The lawmakers fear President-elect Trump’s staunchly pro-Israel se…,https://thehill.com/homenews/5011923-democrats-west-bank-palestinians-trump/,,,
2024-11-29T17:00:00Z,the-hill,The Hill,general,en,us,"Ella Lee, Zach Schonfeld",Trump to regain pardon power: Here’s who could be looking for help,"President-elect Trump will gain back vast powers when he retakes the nation’s highest office, including the ability to grant pardons. During his first four years as president, Trump granted 144 pardons — a notably low number that included several of his allie…",https://thehill.com/regulation/court-battles/5012488-trump-pardons-second-term/,,,
2024-11-29T11:00:00Z,the-hill,The Hill,general,en,us,Amie Parnes,Ranking the Democrats: Here’s who the party could nominate next as president,"Democrats are licking their wounds after Vice President Harris’s defeat to President-elect Trump, but already are looking toward who might lead their party in a 2028 presidential contest. It’s a fight that looks wide open. The certainty is that Trump himself …",https://thehill.com/homenews/campaign/5013304-democrats-2028-presidential-contenders/,,,
2024-11-29T11:00:00Z,the-hill,The Hill,general,en,us,Alexander Bolton,Democratic senators say they bungled border security in 2024,"Democratic senators are privately acknowledging that their party committed “political malpractice” by bungling the issue of border security, which they view as a driving factor behind President-elect Trump’s sweeping victory and their loss of four Senate seat…",https://thehill.com/homenews/senate/5013141-democratic-senators-border-security/,,,
2024-11-29T00:35:21Z,the-hill,The Hill,general,en,us,Lauren Irwin,Biden reiterates US support for Ukraine after ‘horrific’ Russian attack,"President Biden reiterated the United States’s support for Ukraine as it deals with the recent “horrific” Russian attack. “Overnight, Russia carried out a horrific aerial attack against Ukraine. Ukrainian authorities report that Russia launched nearly 200 mis…",https://thehill.com/policy/international/5014491-biden-ukraine-russian-attack/,,,
2024-11-28T17:57:59Z,the-hill,The Hill,general,en,us,Tara Suter,Biden on Trump’s tariff plan: ‘I hope he rethinks it’,"President Biden said Thursday that he hopes President-elect Trump “rethinks” some of his tariff plans. “I hope he rethinks it. I think it’s a counterproductive thing to do,” the president said in Nantucket, Mass., discussing tariff plans for Canada and Mexico…",https://thehill.com/homenews/administration/5014253-biden-trump-tariffs-canada-mexico/,,,
2024-11-28T15:12:57Z,the-hill,The Hill,general,en,us,Tara Suter,"Israel, Hezbollah accuse each other of violating ceasefire","Israel and Hezbollah accused each other of violating terms in the temporary ceasefire that went into effect Wednesday, according to multiple reports. The accusations began after Israel fired on southern Lebanon on Wednesday, wounding two people. The Israel De…",https://thehill.com/policy/international/5014020-israel-hezbollah-ceasefire-violation-accusations/,,,
2023-03-29T13:11:17Z,the-irish-times,The Irish Times,general,en,ie,Sarah Burns,"Inquiry into Defence Forces failings ‘as soon as possible’, Varadkar says",Taoiseach said Defence Forces needs ‘fundamental and immediate cultural and behavioural change’,https://www.irishtimes.com/politics/oireachtas/2023/03/29/inquiry-into-defence-forces-failings-as-soon-as-possible-varadkar-says/,,,
2023-03-29T12:56:56Z,the-irish-times,The Irish Times,general,en,ie,Ed Power,Bear Grylls Meets President Zelenskyy review: TV action man eager to set the world to rights,"In this Channel 4 documentary, Grylls is very good at being earnest and is genuinely moved by the fortitude of Ukraine",https://www.irishtimes.com/culture/tv-radio/2023/03/29/bear-grylls-meets-president-zelenskyy-review-tv-action-man-eager-to-set-the-world-to-rights/,,,
2023-03-29T12:05:51Z,the-irish-times,The Irish Times,general,en,ie,Mary Carolan,Principal hoped she could ‘work through’ issue with Enoch Burke before email challenge,Mr Burke is not participating in the action between him and Wilson’s Hospital School,https://www.irishtimes.com/crime-law/courts/2023/03/29/principal-hoped-she-could-work-through-issue-with-enoch-burke-before-email-challenge/,,,
2023-03-29T12:04:54Z,the-irish-times,The Irish Times,general,en,ie,Tom Tuite,Judge tells prisoner Simeon Burke he could be released with ‘one flick of a pen’,Enoch Burke’s brother has adamantly refused to sign a bail bond with a condition to stay away from Four Courts,https://www.irishtimes.com/crime-law/courts/2023/03/29/judge-tells-prisoner-simeon-burke-he-could-be-released-with-one-flick-of-a-pen/,,,
2023-03-29T11:16:57Z,the-irish-times,The Irish Times,general,en,ie,Sarah Burns,Government defeats no-confidence motion by 86 votes to 67,"Rebel Green Neasa Hourigan voted with the Government, as did a number of Independent TDs",https://www.irishtimes.com/politics/oireachtas/2023/03/29/government-defeats-no-confidence-motion-by-86-votes-to-67/,,,
2023-03-29T11:03:52Z,the-irish-times,The Irish Times,general,en,ie,Richard Cantillon,"After a pandemic surge, are house prices finally going to fall?",Daft.ie has found that asking prices are falling for the first time in a decade,https://www.irishtimes.com/business/2023/03/29/after-a-pandemic-surge-are-house-prices-going-to-fall/,,,
2023-03-29T11:01:24Z,the-irish-times,The Irish Times,general,en,ie,Colin Gleeson,New Dart carriages revealed ahead of entering service in 2025,"Move is part of the Dart+ programme, which will more than double capacity and  treble electrification",https://www.irishtimes.com/ireland/2023/03/29/new-dart-carriages-revealed-ahead-of-entering-service-in-2025/,,,
2023-03-29T10:12:25Z,the-irish-times,The Irish Times,general,en,ie,Colin Gleeson,State will not turn away refugees despite impact on tourism industry – Eamon Ryan,Green Party leader was responding to assertion by Fáilte Ireland that non-accommodation providers in sector will lose €1.1bn in revenues,https://www.irishtimes.com/business/2023/03/29/state-will-not-turn-away-refugees-despite-impact-on-tourism-industry-eamon-ryan/,,,
2023-03-29T04:15:00Z,the-irish-times,The Irish Times,general,en,ie,Jennifer Bray,"Abortion rules should be relaxed, review to recommend",Minister for Health Stephen Donnelly considering report by barrister Marie O’Shea which examined operation of the existing law,https://www.irishtimes.com/ireland/social-affairs/2023/03/29/review-calls-for-abortion-law-to-be-relaxed/,,,
2023-03-29T04:00:03Z,the-irish-times,The Irish Times,general,en,ie,Michael McDowell,Michael McDowell: Car use is not simply the prerogative of the odious and hysterical middle class,Michael McDowell: Any suggestion that public transport will suffice to sustain the entire transport needs of a vast number of people is fanciful and unrealistic,https://www.irishtimes.com/opinion/2023/03/29/car-use-is-not-simply-the-prerogative-of-the-odious-and-hysterical-middle-class/,,,
2024-11-29T16:07:28Z,the-huffington-post,The Huffington Post,general,en,us,Elyse Wanshel,20 Of The Funniest Tweets About Cats And Dogs This Week (Nov. 23-29),"""sinking your entire teeth into a thick ass piece of cardboard must feel good as hell for a cat""",https://www.huffpost.com/entry/cats-dogs-funny-tweets-november-23-29_n_67464a2ce4b0733bf01defa3,,,
2024-11-29T14:58:38Z,the-huffington-post,The Huffington Post,general,en,us,Josephine Harvey,JD Vance Weirds People Out With 'Embarrassing' Trump-Loving Thanksgiving Post,"""If this feels normal to you, you're in a cult,"" one critic reacted.",https://www.huffpost.com/entry/jd-vance-trump-thanksgiving-post_n_6749b89be4b02079326a8393,,,
2024-11-29T13:58:27Z,the-huffington-post,The Huffington Post,general,en,us,Marita Vlachou,Joe Biden Warns Trump Not To 'Screw Up' Relationships With Allies Over Tariff Threats,"Earlier this week, Trump said he would impose a 25% tariff on all goods from Mexico and Canada as soon as he takes office.",https://www.huffpost.com/entry/joe-biden-trump-tariffs-mexico-canada_n_674994f3e4b0e49e029f1e35,,,
2024-11-29T11:09:18Z,the-huffington-post,The Huffington Post,general,en,us,AP,5-Time Tennis Grand Slam Champion Accepts Suspension In Doping Case,"Tennis officials accepted Iga Swiatek's explanation that her positive test was caused by the contamination of a nonprescription medication, melatonin.",https://www.huffpost.com/entry/swiatek-doping-suspension_n_67499de3e4b00c1938a00775,,,
2024-11-29T10:54:14Z,the-huffington-post,The Huffington Post,general,en,us,Lee Moran,Donald Trump Mocked For Sharing Thanksgiving Meal Spoof With Himself As Main Course,Social media users had a feast roasting the president-elect over an edited clip that he shared online.,https://www.huffpost.com/entry/donald-trump-joe-biden-video-turkey_n_6749854be4b082d91c973487,,,
2024-11-29T10:45:19Z,the-huffington-post,The Huffington Post,general,en,us,Jonathan Cohn,"The Biden Administration Made A Big Decision On Ozempic, But RFK Jr. Could Tank It","Whether millions gain access to breakthrough anti-obesity treatments may depend on Kennedy, Mehmet Oz and other key players in Trumpland.",https://www.huffpost.com/entry/rfk-jr-biden-ozempic_n_67477925e4b04f61b2995549,,,
2024-11-29T10:45:19Z,the-huffington-post,The Huffington Post,general,en,us,Jonathan Nicholson,"Washington’s Football Team Ditched Its Offensive Name, But A Senator Wants To Save The Logo","A senator is pushing the NFL team to “restore” the former logo, which is widely seen by Native American groups as insulting.",https://www.huffpost.com/entry/washington-commanders-old-logo-stadium_n_6747aa12e4b08e4755037aec,,,
2024-11-29T08:04:54Z,the-huffington-post,The Huffington Post,general,en,us,Lee Moran,Marjorie Taylor Greene's Trumpian Rebrand Of Thanksgiving Gets Cooked By Critics,Commenters did not give thanks for the far-right Republican's post.,https://www.huffpost.com/entry/marjorie-taylor-greene-thanksgiving-message-2024_n_67496034e4b0e49e029f05c0,,,
2024-11-29T08:00:19Z,the-huffington-post,The Huffington Post,general,en,us,Jillian Wilson,This 1 Activity Is Great For Your Brain — And It's Extremely Simple To Do,"Specifically, research shows it can help you process information faster.",https://www.huffpost.com/entry/exercise-benefits-brain-health-study_l_6744d813e4b0afc053132f75,,,
2024-11-29T06:29:02Z,the-huffington-post,The Huffington Post,general,en,us,Lee Moran,Fox News Host Gives Trump Voters 1 Huge Reality Check: 'Let's Be Realistic',"""Who’s going to pay for that?"" asked Julie Banderas.",https://www.huffpost.com/entry/julie-banderas-trump-policy_n_674955e5e4b0d2a906b90e6c,,,
2022-07-07T21:37:31.2068471Z,the-american-conservative,The American Conservative,general,en,us,,Culture Archives - The American Conservative,,https://www.theamericanconservative.com/category/culture/,,,
2022-07-07T21:37:28.1816944Z,the-american-conservative,The American Conservative,general,en,us,,Foreign Affairs Archives - The American Conservative,,https://www.theamericanconservative.com/category/foreign-affairs/,,,
2022-07-07T21:37:27.3936289Z,the-american-conservative,The American Conservative,general,en,us,,Politics Archives - The American Conservative,,https://www.theamericanconservative.com/category/politics/,,,
2022-06-16T10:05:33Z,the-globe-and-mail,The Globe And Mail,general,en,ca,Simon Lewis,"Leaders of Germany, France, Italy, Romania in Ukraine to support fight against Russia","Zelensky expected to push for more arms to withstand the Russian invaders after accusing France, Germany and Italy of foot-dragging",https://www.theglobeandmail.com/world/article-leaders-of-germany-france-italy-romania-in-ukraine-to-support-fight/,,,
2022-06-16T09:30:00Z,the-globe-and-mail,The Globe And Mail,general,en,ca,David Milstead,"BlackBerry spins its wheels, but the paydays continue","The pay-for-performance disconnect at BlackBerry is real and getting worse, and shareholders will likely send that message next week",https://www.theglobeandmail.com/business/commentary/article-blackberry-spins-its-wheels-but-the-paydays-continue/,,,
2022-06-16T09:00:00Z,the-globe-and-mail,The Globe And Mail,general,en,ca,Unknown,Panic at the crypto,Cryptocurrencies have taken another beating this week. Globe columnist Tim Kiladze makes sense of this latest crash,https://www.theglobeandmail.com/podcasts/the-decibel/article-panic-at-the-crypto/,,,
2022-06-16T09:00:00Z,the-globe-and-mail,The Globe And Mail,general,en,ca,Erica Alini,‘It’s a dog eat dog world’ as housing cool-down helps ignite rental market wars,"Rents in many parts of Canada are nearing or surging past prepandemic records, just as property values and home resale transactions declined for the second consecutive month in May",https://www.theglobeandmail.com/investing/personal-finance/household-finances/article-its-a-dog-eat-dog-world-as-housing-cool-down-helps-ignite-rental/,,,
2022-06-16T01:18:17Z,the-globe-and-mail,The Globe And Mail,general,en,ca,Molly Hayes,OPP officers provide testimony at inquest into 2015 triple murders,Four OPP officers addressed difficulties they had while discovering three deaths in 2015 connected by intimate partner violence,https://www.theglobeandmail.com/canada/article-opp-provide-testimony-at-inquest-into-2015-triple-murders/,,,
2022-06-15T19:46:27Z,the-globe-and-mail,The Globe And Mail,general,en,ca,Rob Carrick,"Across Canada, renters are now saving hundreds of dollars over owning","The math on renting vs. owning a home has changed drastically, says Rob Carrick in this look at the owning versus renting debate",https://www.theglobeandmail.com/investing/personal-finance/young-money/article-across-canada-renters-are-now-saving-hundreds-of-dollars-over-owning/,,,
2022-06-15T19:24:08Z,the-globe-and-mail,The Globe And Mail,general,en,ca,Lawrence Martin,Liz Cheney is making headway in slaying the Trump dragon,"By spearheading congressional hearings into the Jan. 6 attack on the Capitol, the representative is fast becoming an American heroine",https://www.theglobeandmail.com/opinion/article-liz-cheney-is-making-headway-in-slaying-the-trump-dragon/,,,
2022-06-15T17:00:00Z,the-globe-and-mail,The Globe And Mail,general,en,ca,Wency Leung,‘COVID hasn’t gone away’: Five things health experts say we must do to end the pandemic,"Boosting health care capacity, encouraging third doses and better understanding long COVID are among the issues health experts say need to be addressed",https://www.theglobeandmail.com/canada/article-covid-19-pandemic-not-over/,,,
2022-06-15T12:00:00Z,the-globe-and-mail,The Globe And Mail,general,en,ca,Andrew Coyne,"Partying with the Russians: the message is, this will all blow over some day","By sending a representative, Global Affairs betrayed its attitude toward the war in Ukraine",https://www.theglobeandmail.com/opinion/article-partying-with-the-russians-the-message-is-this-will-all-blow-over-some/,,,
2022-06-14T11:00:00Z,the-globe-and-mail,The Globe And Mail,general,en,ca,"Molly Hayes, Elizabeth Renzetti, Tavia Grant",Many women who suffer from intimate partner violence don’t trust the police. Why are they the default response?,"Fearing discrimination, revictimization or arrests that do more harm than good, women in Canada often stay silent about their abuse. Other jurisdictions are trying to remove police from the equation",https://www.theglobeandmail.com/canada/article-intimate-partner-violence-police-response/,,,
2024-11-30T00:02:00Z,techradar,TechRadar,technology,en,us,Marc McLaren,"NYT Strands today — hints, answers and spangram for Saturday, November 30 (game #272)",Our clues will help you solve the NYT's Strands today and keep that streak going,https://www.techradar.com/computing/websites-apps/nyt-strands-today-answers-hints-30-november-2024,,,
2024-11-30T00:02:00Z,techradar,TechRadar,technology,en,us,Marc McLaren,"Quordle today – hints and answers for Saturday, November 30 (game #1041)",Our clues will help you solve Quordle today and keep that streak going,https://www.techradar.com/computing/websites-apps/quordle-today-answers-clues-30-november-2024,,,
2024-11-30T00:02:00Z,techradar,TechRadar,technology,en,us,Marc McLaren,"NYT Connections today — hints and answers for Saturday, November 30 (game #538)",Our clues will help you solve the NYT's Connections puzzle today and keep that streak going,https://www.techradar.com/gaming/nyt-connections-today-answers-hints-30-november-2024,,,
2024-11-29T23:00:00Z,techradar,TechRadar,technology,en,us,Eric Hal Schwartz,ChatGPT might finally face some real competition from Grok,xAI plans a standalone app,https://www.techradar.com/computing/artificial-intelligence/chatgpt-might-finally-face-some-real-competition-from-grok,,,
2024-11-29T21:25:19Z,techradar,TechRadar,technology,en,us,Josephine Watson,"I'm a seasoned Dyson Black Friday deals hunter – here are the best Airwrap, vacuum and fan deals I'd recommend",Black Friday Dyson deals are heating up,https://www.techradar.com/live/news/black-friday-dyson-deals-2024-live,,,
2024-11-29T20:00:00Z,techradar,TechRadar,technology,en,us,Eric Hal Schwartz,"Shoppers are turning to AI to win at Black Friday – and you could, too",AI assistants are becoming helpful shopping guides for the holidays,https://www.techradar.com/computing/artificial-intelligence/shoppers-are-turning-to-ai-to-win-at-black-friday-and-you-could-too,,,
2024-11-29T16:14:20Z,techradar,TechRadar,technology,en,us,Rob Dwiar,I'm a PlayStation expert and these are the best Black Friday PS5 deals I've ever seen,We're swimming deals and discounts!,https://www.techradar.com/live/news/black-friday-ps5-deals-ps5-pro-discounts-2024,,,
2024-11-28T10:08:35Z,techradar,TechRadar,technology,en,us,Matt Hanson,"I'm a Black Friday veteran and trust me, these are the only Black Friday laptop deals you need","Black Friday is only a few days away, and these are the best laptop deals I've found so far",https://www.techradar.com/live/news/black-friday-2024-laptop-deals,,,
2023-02-17T08:58:58Z,techradar,TechRadar,technology,en,us,"Tom Power, Grace Dean",New Prime Video movies: every new film being released in November 2024,These are the new Prime Video movies coming to Amazon's streaming service this month,https://www.techradar.com/news/new-prime-video-movies,,,
2023-02-12T08:00:57Z,techradar,TechRadar,technology,en,us,"Tom Power, Grace Dean",New Max movies: all of the new films to stream in November 2024,These are the new Max movies are coming to the streaming giant this month,https://www.techradar.com/news/new-hbo-max-movies,,,
2019-12-27T18:58:22Z,techcrunch-cn,TechCrunch (CN),technology,zh,zh,王博源,TechCrunch 中文版的 2019 不严肃年度好物推荐 | TechCrunch 中文版,"https://www.youtube.com/watch?v=EavTye99eZA

 

2019年就要过去了，各位觉得这一年过得怎么样呢？（崔健曰：凑合！）今年我们再次向TechCrunch中英文作者、编辑、翻译发出邀请，整理2019年对他们有积极影响的身外之物，顺便托物言志谈谈自己的这一年。虽然我们是科技创投媒体，不过推荐的东西不一定和科技有关，也没有任何厂商业配置入，请大家放心。
鹏辉，TechCrunch 中文版作者
死亡搁浅



今年争议最大的游戏。有人觉得这是乏味的步行…",https://techcrunch.cn/2019/12/27/techcrunchcns-favorite-things-of-2019/,,,
2019-12-27T16:46:58Z,techcrunch-cn,TechCrunch (CN),technology,zh,zh,Brian Heater,盘点 2019 年消失的明星创业公司 | TechCrunch 中文版,"创业公司会因为各种原因而失败，但有一点不会改变：创业是极其困难的事。想要创办一家成功的公司，需要的不仅仅是热情，以及找到合适的人才（尽管很明显这两点很重要）。成功的创业者需要在许许多多细节上做到完美。

粗略地回顾下今年的创业公司，可以发现并没有什么公司能带来像去年Theranos那样的轰动性故事。Theranos的故事被写成了畅销书，改编成了纪录片，相关电影也即将上映。不过某些公司，例如MoviePass，可能已经逐渐接近。

通常来说，每看到一家Theranos，我们同时也会看到数十位辛勤创业者的故事…",https://techcrunch.cn/2019/12/27/startups-lost-in-2019/,,,
2019-12-27T12:08:04Z,techcrunch-cn,TechCrunch (CN),technology,zh,zh,Brian Heater,土耳其法院裁定政府封锁维基百科违宪 | TechCrunch 中文版,"在被土耳其政府封锁两年半之后，维基百科似乎收到了刑罚终止令。本周，土耳其宪法法院裁定，该国政府在2017年4月颁布的维基百科禁令侵犯了公民的言论自由。

从2017年5月开始，维基媒体基金会（Wikimedia Foundation）就一直在对禁令提出抗辩。在土耳其宪法法院的表决中，法官以10比6的投票结果裁定禁令违宪，这有望恢复土耳其用户对维基百科的访问。

2017年，土耳其成为全球第二个完全禁止访问维基百科的国家，因为维基百科上有条目声称土耳其跟伊斯兰国（ISIS）以及其他恐怖组织存在联系。土耳其政…",https://techcrunch.cn/2019/12/27/wikipedia-ban-ruled-unconstitutional-by-turkish-court/,,,
