publishedAt,source_id,source_name,category,language,country,author,title,description,url,sentiment_score,title_eng,description_eng
2024-11-29T12:30:01Z,newsweek,Newsweek,general,en,us,,The Rise of the Sustainability Class | Opinion,"Sustainability might not be cheap, but it certainly is pleasant to consume.",https://www.newsweek.com/rise-sustainability-class-opinion-1991450,,,
2024-11-29T11:00:01Z,newsweek,Newsweek,general,en,us,https://www.facebook.com/realjoshhammer,Gratitude Is Our Defining Ideal,"Thanksgiving, and perhaps the holiday season more broadly, is a good time to take stock of all that we have been blessed with.",https://www.newsweek.com/gratitude-our-defining-ideal-opinion-1992855,,,
2024-11-28T22:38:48Z,newsweek,Newsweek,general,en,us,Shannon McDonagh,"Georgia halts EU talks, citing ""blackmail"" amid election controversy",The EU froze €30 million in financial aid to Georgia earlier this year over concerns for its democracy.,https://www.newsweek.com/georgia-suspends-eu-talks-election-russia-1993263,,,
2024-11-28T12:00:01Z,newsweek,Newsweek,general,en,us,,Indigenous Communities Need Access to a High-Integrity Carbon Market,"Despite our role as protectors of forest ecosystems, Indigenous communities receive less than 1 percent of global climate finance.",https://www.newsweek.com/indigenous-communities-need-access-high-integrity-carbon-market-opinion-1991563,,,
2024-11-28T10:00:01Z,newsweek,Newsweek,general,en,us,Joe Kozlowski,"EA Sports VP Talks Madden Ratings, Annual Pressure and Late Coach's Legacy","On Thanksgiving, the NFL remembers the late John Madden. Newsweek spoke with one of the men behind the iconic ""Madden"" franchise.",https://www.newsweek.com/ea-sports-vp-talks-madden-ratings-annual-pressure-late-coachs-legacy-1991988,,,
2024-11-28T01:39:19Z,newsweek,Newsweek,general,en,us,,The Progressive Case for RFK Jr. | Opinion,Americans should support Kennedy's nomination. He is the best chance of reigning in corruption and corporate power while prioritizing public health over profit.,https://www.newsweek.com/progressive-case-rfk-jr-opinion-1992709,,,
2024-11-27T20:24:46Z,newsweek,Newsweek,general,en,us,,"RFK's Policies Sound Populist, But Indulge Elite Fantasies | Opinion",President-elect Donald Trump is stacking the Department of Health and Human Services with people who are poised to favor the health fantasies of the rich.,https://www.newsweek.com/rfks-policies-sound-populist-actually-indulge-elite-fantasies-opinion-1992550,,,
2024-11-30T02:22:24.977313Z,rbc,RBC,general,ru,ru,RBC,«Безмолвный убийца». Как экономический кризис тихо накрывает Таиланд :: РБК Pro,"Экономика Таиланда сильно отстает от других стран Юго-Восточной Азии и находится на грани кризиса. Как активно прогрессирующее в последние 40 лет государство пришло к тому, что сейчас вынуждено раздавать деньги населению для стимулирования роста ВВП - РБК Pro",https://pro.rbc.ru/demo/66fd60c39a794719596042f3?from=from_main_5&amp;utm_source=rbc.ru&amp;utm_medium=inhouse_media&amp;utm_campaign=lines_5&amp;utm_content=66fd60c39a794719596042f3&amp;utm_term=10.4Z_noauth_alt,,,
2024-11-30T01:51:43Z,rbc,RBC,general,ru,ru,RBC,В крупные ночные клубы Москвы пришли силовики,"Посетители клубов «Мутабор», сменившего название на Arma, а также Mono и Simach, сообщают о визите силовиков. С их слов, гостей выборочно осматривают, некоторых задержали",https://www.rbc.ru/society/30/11/2024/674a68549a79474b8a2cb654?from=from_main_2,,,
2024-11-30T01:06:13Z,rbc,RBC,general,ru,ru,RBC,Reuters узнал о приказе армии Сирии отступать из основных районов Алеппо,"В Алеппо закрыт аэропорт и все ведущие в город дороги, правительственным войскам приказано «осторожно отступать», выяснил Reuters. Армия докладывает о восстановлении контроля над некоторыми позициями и крупных потерях противника",https://www.rbc.ru/politics/30/11/2024/674a5ce99a794715990f1dec?from=from_main_3,,,
2024-11-30T00:00:26Z,rbc,RBC,general,ru,ru,RBC,Появились первые фото Нотр-Дама после реставрации из-за пожара,"Официальное открытие Нотр-Дама, пострадавшего из-за пожара в 2019 году, пройдет 7 декабря. Как выглядит собор изнутри после пяти лет реставрации — в фотогалерее РБК",https://www.rbc.ru/society/30/11/2024/6749c0129a794777c03bb14f?from=from_main_8,,,
2024-11-29T21:58:51Z,rbc,RBC,general,ru,ru,RBC,Немецкий генерал предрек ВСУ потерю «ключевого города» Донбасса к 2025-му,"ВСУ придется сдать Покровск в конце этого или начале следующего года, оценил генерал-майор Бундесвера Кристиан Фройдинг. Этот город — центр железнодорожных и автомобильных путей и важен для снабжения войск",https://www.rbc.ru/politics/30/11/2024/674a2ad19a79476817ec2634?from=from_main_4,,,
2024-11-29T19:41:25Z,rbc,RBC,general,ru,ru,RBC,Полиция применила водометы против протестующих в Тбилиси,"Между силовиками и протестующими начались стычки, из толпы бросают яйца и петарды. МВД сообщило об одном пострадавшем полицейском. Президент Зурабишвили призвала полицию «не поднимать руку» на собравшихся",https://www.rbc.ru/politics/29/11/2024/674a16219a7947c459ad5839?from=from_main_6,,,
2024-11-29T19:22:44Z,rbc,RBC,general,ru,ru,RBC,В Казахстане объявили в розыск владельца советского челнока «Буран»,"Владельца одного из советских космических челноков Буран Даурена Мусу разыскивают в Казахстане, он находится в розыске со вторника, 26 ноября. Соответствующая информация приводится на сайте МВД ...",https://www.rbc.ru/rbcfreenews/674a0bb39a794727e12d5c01?from=from_main_10,,,
2024-11-29T18:44:15Z,rbc,RBC,general,ru,ru,RBC,Зеленский назвал условие прекращения боев без возвращения всех территорий,"Киев предлагает накрыть «зонтиком» альянса все оставшиеся под его контролем территории для достижения мира. Москва предупреждала, что такой вариант ее не устроит и будет расцениваться как эскалация",https://www.rbc.ru/politics/29/11/2024/674a0ada9a794777935bf0bf?from=from_main_9,,,
2024-11-29T16:23:36Z,rbc,RBC,general,ru,ru,RBC,"Кулеба допустил поражение Украины, «если так будет продолжаться» и дальше","Украина сейчас не имеет возможности переломить ситуацию, дела на поле боя «плохие», отметил бывший глава МИДа",https://www.rbc.ru/politics/29/11/2024/6749dfcb9a7947eceaed545f?from=from_main_11,,,
2024-11-29T14:52:59Z,rbc,RBC,general,ru,ru,RBC,Что известно о самых масштабных боях в Сирии с 2020 года,"Третьи сутки на севере Сирии идут бои — самые ожесточенные с марта 2020 года, когда при посредничестве России и Турции в стране было заключено перемирие. В чем причина эскалации и какую позицию заняла Россия — в статье РБК",https://www.rbc.ru/politics/29/11/2024/6749c6f49a79474d32a4dee2?from=from_main_7,,,
2024-08-12T20:36:23Z,polygon,Polygon,entertainment,en,us,Charlie Hall,New 35-minute video from the STALKER 2 team leans into authenticity,"A new STALKER 2 development video shows off more than 35 minutes of gameplay. Authenticity is key, and the final game will include many settings found in the original.",https://www.polygon.com/24218882/stalker-2-deep-dive-video,,,
2024-08-12T19:20:45Z,polygon,Polygon,entertainment,en,us,Ana Diaz,Baldur’s Gate 3 just won the biggest award in fantasy and sci-fi,Larian Studios won a Hugo Award for the writing in Baldur’s Gate 3. It is the second video game to win the literary sci-fi and fantasy award.,https://www.polygon.com/24218806/baldurs-gate-3-wins-hugo-award,,,
2024-08-12T19:00:31Z,polygon,Polygon,entertainment,en,us,Zosha Millman,Netflix’s new One Piece anime first look shows how hard adaptation is,Netflix is adapting One Piece into The One Piece with the help of Wit Studio. And the first look at the new anime remake looks promising — and difficult,https://www.polygon.com/anime/24218850/netflix-one-piece-anime-first-look-behind-scenes,,,
2024-08-12T16:52:57Z,polygon,Polygon,entertainment,en,us,Nicole Carpenter,Pokémon voice actor Rachael Lillis dies at 46,Pokémon voice actor Rachael Lillis died on Saturday after being diagnosed with breast cancer. She was best known for playing Team Rocket’s Jessie and Ash Ketchum’s companion Misty.,https://www.polygon.com/24218705/rachael-lillis-pokemon-voice-actor-death-misty-jesse,,,
2024-08-12T00:42:59Z,polygon,Polygon,entertainment,en,us,Michael McWhertor,Hi-Fri Rush studio saved by PUBG’s Krafton after Microsoft shut down,"PUBG publisher Krafton has taken over Hi-Fi Rush and Evil Within developer Tango Gameworks, which Microsoft and Bethesda closed in May 2024.",https://www.polygon.com/24218268/krafton-tango-gameworks-bethesda-microsoft-hi-fi-rush,,,
2024-08-11T12:48:26Z,polygon,Polygon,entertainment,en,us,Matt Patches,Disney is finally doing Villains Land at Disney World,"Walt Disney World will get a Villains Land expansion, and while opening date is unclear, it’s under construction and ready to indulge Decesdents fans.",https://www.polygon.com/24217891/disney-world-villains-land-plans,,,
2024-08-11T12:18:45Z,polygon,Polygon,entertainment,en,us,Matt Patches,Robert Downey Jr. is Iron Man again—for Disney’s big Avengers land rides,"He’s Doctor Doom in Marvel movies, but for Marvel’s Avengers Campus, RDJ is back as Tony Stark for Stark Flight Lab and Avengers: Infinity Defense rides.",https://www.polygon.com/24217880/robert-downey-jr-iron-man-avengers-campus-rides,,,
2024-08-10T04:44:21Z,polygon,Polygon,entertainment,en,us,Matt Patches,Disney’s D23 Snow White trailer unveils Rachel Zegler’s updated princess,Rachel Zegler stars alongside seven CG dwarfs in the race-changing reimagining of the 1937 movie from director Marc Webb. The movie releases next spring.,https://www.polygon.com/24216163/snow-white-trailer-2025-disney-d23,,,
2024-08-10T04:38:58Z,polygon,Polygon,entertainment,en,us,Matt Patches,Disney’s ‘live-action’ Stitch revealed from summer 2025 remake,"Lilo & Stitch is coming to theaters in 2025. D23 didn’t offer a trailer, but we got a reveal of Stitch’s blue alien design.",https://www.polygon.com/24217117/lilo-stitch-remake-photo-release-d23,,,
2024-08-10T02:02:15Z,polygon,Polygon,entertainment,en,us,"Zosha Millman, Susana Polo, Petrana Radulovic, Matt Patches",Disney’s D23 2024: All the big trailers and news in one place,"Marvel, Star Wars, Pixar, Disney Animation reveal their new movies, tv shows, trailers, and plans for the 2025 and beyond at the Disney version of Comic-Con.",https://www.polygon.com/24217230/d23-news-trailers-disney-marvel-star-wars-2024,,,
2024-11-29T07:00:00Z,medical-news-today,Medical News Today,health,en,us,Jessica Freeborn,Which cardiovascular drugs may help lower dementia risk?,"Taking medications like blood pressure and lipid-lowering drugs for more than 5 years is associated with a lower incidence of dementia, a new study has found.",https://www.medicalnewstoday.com/articles/which-cardiovascular-drugs-may-help-lower-dementia-risk,,,
2024-11-28T16:22:08Z,medical-news-today,Medical News Today,health,en,us,"Paul Ian Cross, PhD",Cardiovascular risk may impact cognitive decline in men years earlier than women,"Men with cardiovascular disease risk factors, including obesity, may face earlier brain health decline compared to women up to a decade sooner, a new study suggests.",https://www.medicalnewstoday.com/articles/cardiovascular-risk-may-impact-cognitive-decline-men-years-earlier-women,,,
2024-11-27T12:00:00Z,medical-news-today,Medical News Today,health,en,us,Deep Shukla,How to preserve muscle mass on weight-loss drugs like Wegovy,"There is some debate as to whether GLP-1 agonist drugs like Wegovy can lead to unhealthy muscle mass loss in addition to general weight loss. Is this a real concern, and if so, how can a person maintain their muscle mass on GLP-1 drugs?",https://www.medicalnewstoday.com/articles/how-to-preserve-muscle-mass-on-weight-loss-drugs-like-wegovy,,,
2024-11-26T11:27:00Z,medical-news-today,Medical News Today,health,en,us,Corrie Pelc,Can developing type 2 diabetes before age 50 raise dementia risk?,"Getting diagnosed with type 2 diabetes before the age of 50 may increase one's risk of developing dementia by 1.9 times, a new study has found.",https://www.medicalnewstoday.com/articles/can-developing-type-2-diabetes-before-age-50-raise-dementia-risk,,,
2024-11-25T11:00:00Z,medical-news-today,Medical News Today,health,en,us,Robby Berman,Craving fatty foods when stressed? Cocoa may offset impact,"A flavonoid found in cocoa drinks could help reduce recovery time from stress even when a person reaches for unhealthy fatty foods, a recent study has found.",https://www.medicalnewstoday.com/articles/craving-fatty-foods-when-stressed-cocoa-may-offset-impact,,,
2024-11-12T13:00:00Z,medical-news-today,Medical News Today,health,en,us,"Maria Cohut, Ph.D.",5 things everyone should know about menopause,"In this episode of In Conversation, we look at some of the most important information everyone should have about perimenopause and menopause with our special guest, Dr. Kate Clancy, from the University of Illinois.",https://www.medicalnewstoday.com/articles/5-things-everyone-should-know-about-menopause,,,
2024-10-17T08:30:00Z,medical-news-today,Medical News Today,health,en,us,Yasemin Nicola Sakay,Is coffee good for your heart health? 3 studies offer insights,Can drinking coffee yield cardiovascular benefits? Can too much caffeine increase stroke risk? Three recent studies examine the latest evidence.,https://www.medicalnewstoday.com/articles/caffeine-coffee-heart-health-cardiovascular-benefits-studies,,,
2024-10-15T11:00:00Z,medical-news-today,Medical News Today,health,en,us,Robby Berman,Carbs or fats for breakfast? Which is best for healthy weight in men vs women?,"A recent study suggests that a carbohydrate-rich breakfast for men and a fat-rich breakfast for women may be best for maintaining a healthy weight, due to sex-specific metabolic differences.",https://www.medicalnewstoday.com/articles/carbs-or-fats-for-breakfast-which-is-best-for-healthy-weight-in-men-vs-women,,,
2024-10-01T21:37:16.3164899Z,medical-news-today,Medical News Today,health,en,us,MNT Editorial Team,In Conversation podcast,"Medical News Today’s In Conversation podcast engages with expert voices across various fields. The conversations focus on a range of topics, from the latest news in science to the deepest scientific conundrums.",https://www.medicalnewstoday.com/articles/in-conversation-podcast,,,
2023-11-01T18:52:28.0801464Z,medical-news-today,Medical News Today,health,en,us,"Jillian Kubala, MS, RD",Psoriasis and inflammation: What is the link?,"While there is no cure for psoriasis, there are steps a person can take to reduce psoriasis-related inflammation and increase the chances of reaching and maintaining remission.",https://www.medicalnewstoday.com/articles/psoriasis-and-chronic-inflammation,,,
2019-05-29T15:00:00Z,mashable,Mashable,entertainment,en,us,Sasha Lekach,How to make iPhone's Screen Time actually helpful,Maybe this year we'll actually spend less time staring at a phone screen.,https://mashable.com/article/screen-time-ios-iphone-wwdc-2019-improve/,,,
2019-05-29T14:51:29Z,mashable,Mashable,entertainment,en,us,Marcus Gilmer,AOC opens up about death threats after baseball team shows offensive video of her,"'Words matter, and can have consequences for safety.'",https://mashable.com/article/aoc-fresno-grizzlies-video-castro-kim-jon-un-death-threats/,,,
2019-05-29T14:00:00Z,mashable,Mashable,entertainment,en,us,Sasha Lekach,Uber will now kick off riders with low ratings,"Drivers can get deactivated, and now so can you.",https://mashable.com/article/uber-us-canada-rider-ratings-deactivation/,,,
2019-05-29T13:00:00Z,mashable,Mashable,entertainment,en,us,Kellen Beck,Metal Mario makes his Hot Wheels debut this summer,Metal Mario joins the fray.,https://mashable.com/article/metal-mario-hot-wheels/,,,
2019-05-29T13:00:00Z,mashable,Mashable,entertainment,en,us,Karissa Bell,"Amazon challenges Google with smaller, cheaper Echo Show",Amazon just ratcheted up the pressure on Google.,https://mashable.com/article/amazon-echo-show-5/,,,
2019-05-29T12:00:00Z,mashable,Mashable,entertainment,en,us,Anthony McGlynn,DC’s ‘Doom Patrol’ is the rare superhero show that understands trauma,"The longest, greatest battles we face are against ourselves.",https://mashable.com/article/doom-patrol-mental-health-trauma/,,,
2019-05-28T21:52:08Z,mashable,Mashable,entertainment,en,us,Rachel Kraus,Trump and Biden court older women demographic with Facebook ads,"Combined, they have spent millions on targeted Facebook ads.",https://mashable.com/article/biden-trump-facebook-ads-targeting-women/,,,
2021-06-18T08:33:35Z,marca,Marca,sports,es,es,Marca,"Las vacaciones de los famosos: Laura Escanes, Patricia Conde, Adriana Ugarte, Alice Campello, Miguel �ngel Sil",Llega el calor y los personajes famosos aprovechan para tomar un descanso e irse de vacaciones a lugares tradicionales y tambi�n paradisiacos.,https://www.marca.com/tiramillas/actualidad/album/2021/06/18/60cc58ffe2704e0c0c8b45c5.html,,,
2021-02-02T12:49:24Z,liberation,Libération,general,fr,fr,Elsa Maudet,"Précarité énergétique : «Les journées où il pleut tout le temps, c’est un peu l’enfer»","Comme 3,5 millions de ménages français, Valérie et David peinent à combattre l'humidité et les fuites dans leur maison. Pour financer les travaux, ils sont accompagnés par une association spécialisée.",http://www.liberation.fr/france/2021/02/02/precarite-energetique-les-journees-ou-il-pleut-tout-le-temps-c-est-un-peu-l-enfer_1819030,,,
2021-02-02T12:22:45Z,liberation,Libération,general,fr,fr,Chez Pol,Ces députés qui ne veulent pas plus d’argent,"Indiscrétions piquantes, maladresses vaches ou douces confessions : chaque jour, retrouvez les brèves qui auscultent le monde politique.",http://www.liberation.fr/politiques/2021/02/02/ces-deputes-qui-ne-veulent-pas-plus-d-argent_1819029,,,
2021-02-02T11:42:53Z,liberation,Libération,general,fr,fr,Emma Donada,Covid-19 : vers un dépistage systématique des variants en cas de test PCR positif,"Le 23 janvier, la direction générale de la santé a demandé aux professionnels de santé de faire passer un deuxième test à toutes les PCR positives afin de détecter les éventuels variants.",http://www.liberation.fr/checknews/2021/02/02/covid-19-vers-un-depistage-systematique-des-variants-en-cas-de-test-pcr-positif_1818898,,,
2021-02-02T09:50:51Z,liberation,Libération,general,fr,fr,Victor Boiteau,"Domaines de chasse : en Sologne, les grillages de la discorde","Dans cette région boisée du Centre-Val-de-Loire, l’engrillagement de vastes parcs réservées à la chasse s’accélère. Une pratique légale, mais qui perturbe la circulation des animaux. Et défigure le territoire, selon les associations et les chasseurs locaux.",http://www.liberation.fr/france/2021/02/02/domaines-de-chasse-en-sologne-les-grillages-de-la-discorde_1818950,,,
2021-02-02T07:53:26Z,liberation,Libération,general,fr,fr,Stéphanie Harounyan,"Marseille : «On aime ce club, mais pas au point de faire des violences ou des dégradations»","Quatorze personnes comparaissaient lundi à Marseille après les violences survenues samedi à la Commanderie, le centre d'entraînement de l'OM. Huit d'entre eux resteront en détention jusqu'à l'examen du dossier sur le fond, renvoyé au 24 février.",http://www.liberation.fr/france/2021/02/02/marseille-on-aime-ce-club-mais-pas-au-point-de-faire-des-violences-ou-des-degradations_1819025,,,
2021-02-02T07:22:27.4088598Z,liberation,Libération,general,fr,fr,,"Meurtres conjugaux, des vies derrière les chiffres","Chaque année, plus de cent femmes sont tuées par leur conjoint, leur mari ou leur ex. Derrière une statistique qui se répète froidement chaque année, il y a des prénoms, des histoires, des vies, des victimes collatérales.",https://www.liberation.fr/apps/2018/02/meurtres-conjugaux-derriere-les-chiffres/,,,
2021-02-01T20:01:09Z,liberation,Libération,general,fr,fr,Louise Vincent,Le Kremlin fait monter la répression,"Détention prolongée d’Alexeï Navalny, violences policières, intimidations... L’acharnement du pouvoir russe est de plus en plus décrié à l’étranger.",http://www.liberation.fr/planete/2021/02/01/le-kremlin-fait-monter-la-repression_1819012,,,
2021-02-01T20:01:07Z,liberation,Libération,general,fr,fr,Veronika Dorman,"Alexeï Navalny : vent debout, jusqu’au bout","Le blogueur anticorruption devenu l’ennemi numéro 1 du Kremlin comparaît devant la justice ce mardi. Au fil de son combat politique, il a gagné en stature et en soutiens en s’attaquant frontalement à Poutine, quoi qu’il en coûte.",http://www.liberation.fr/planete/2021/02/01/alexei-navalny-vent-debout-jusqu-au-bout_1819009,,,
2021-02-01T19:36:14Z,liberation,Libération,general,fr,fr,Elsa Maudet,Mal-logement : le parc HLM paralysé par le Covid,"Dans un rapport publié ce mardi, la Fondation Abbé-Pierre estime que 100 000 logements sociaux de moins ont été attribués l’année dernière, à cause de la crise sanitaire et des confinements. Toute la chaîne d’attribution est embouteillée et risque d’exploser …",http://www.liberation.fr/france/2021/02/01/mal-logement-le-parc-hlm-paralyse-par-le-covid_1818999,,,
2021-02-01T12:42:15Z,liberation,Libération,general,fr,fr,"Cédric Mathiot, Pauline Moullot",Les chiffres officiels des hospitalisations liées au Covid-19 sont-ils gonflés ?,La publication d'un article de «Nice-Matin» mi-janvier a relancé la polémique sur la manière dont les statistiques sont fabriquées.,http://www.liberation.fr/checknews/2021/02/01/les-chiffres-officiels-des-hospitalisations-liees-au-covid-19-sont-ils-gonfles_1817820,,,
2024-11-29T21:47:10Z,les-echos,Les Echos,business,fr,fr,Stéphane Loignon,Budget 2025 : S&P accorde un répit à la France,"L'agence de notation américaine Standard & Poor's maintient la note de la France à «AA-», avec une perspective stable. Elle considère que la France devrait parvenir à consolider progressivement ses finances publiques. Mais une censure du budget changerait tou…",https://www.lesechos.fr/economie-france/budget-fiscalite/budget-2025-sp-accorde-un-repit-a-la-france-2134954,,,
2024-11-29T21:01:07Z,les-echos,Les Echos,business,fr,fr,Les Echos,Impôts : le Sénat abaisse les droits de succession pour relancer le marché du logement,Les sénateurs ont voté ce vendredi plusieurs amendements au projet de loi de finances visant à relancer le marché du logement. Malgré l'opposition du gouvernement.,https://www.lesechos.fr/economie-france/budget-fiscalite/impots-le-senat-abaisse-les-droits-de-succession-pour-relancer-le-marche-du-logement-2134949,,,
2024-11-29T19:56:36Z,les-echos,Les Echos,business,fr,fr,Les Echos,"Chez Decathlon, les dividendes versés à la famille Mulliez ne passent pas","Les syndicats ont vivement réagi vendredi à l'annonce du versement d'un milliard d'euros à l'actionnaire de l'enseigne d'équipements sportifs, dont l'autre entreprise phare, Auchan, traverse une grave crise.",https://www.lesechos.fr/industrie-services/conso-distribution/chez-decathlon-les-dividendes-verses-a-la-famille-mulliez-ne-passent-pas-2134939,,,
2024-11-29T18:18:49Z,les-echos,Les Echos,business,fr,fr,Anne Feitz,"Michel Barnier promet d'exempter de ZAN tous les projets industriels, les écologistes vent debout","Dans son plan pour relancer l'industrie en France, le Premier ministre a annoncé ce vendredi plusieurs mesures vivement critiquées par les défenseurs de l'environnement. La règle du zéro artificialisation nette (le ZAN) est dans le viseur du gouvernement.",https://www.lesechos.fr/politique-societe/societe/michel-barnier-promet-dexempter-de-zan-tous-les-projets-industriels-les-ecologistes-vent-debout-2134935,,,
