publishedAt,source_id,source_name,category,language,country,author,title,description,url,sentiment_score,title_eng,description_eng
2024-05-03T20:39:31Z,info-money,InfoMoney,business,pt,br,Bloomberg,"Rede social tenta inovar com criptomoeda, mas preço colapsa 98% na estreia",Projeto ambicioso que propõe a compra e venda de tokens ligados a influenciadores do X decepcionou na estreia e frustrou usuários,https://www.infomoney.com.br/onde-investir/rede-social-tenta-inovar-com-criptomoeda-mas-preco-colapsa-98-na-estreia/,,,
2024-05-03T13:06:03Z,info-money,InfoMoney,business,pt,br,Equipe InfoMoney,Dividendos da semana: Eletrobras e Caixa Seguridade estão entre as empresas que pagam,"A agenda prevê ainda distribuições de nomes como JHSF, CSU Digital, Wilson Sons e Vamos",https://www.infomoney.com.br/onde-investir/dividendos-da-semana-eletrobras-e-caixa-seguridade-estao-entre-as-empresas-que-pagam/,,,
2024-05-02T20:02:22Z,info-money,InfoMoney,business,pt,br,,"AGORA: InfoMoney, AO VIVO, na Reunião Anual da Berkshire Hathaway 2024","Neste sábado, a partir das 18h, o InfoMoney traz uma cobertura especial da reunião anual de acionistas da Berkshire Hathaway, do bilionário Warren Buffett. H...",https://www.youtube.com/watch?v=TAxbrJm215I,,,
2024-11-30T00:40:15Z,independent,Independent,general,en,gb,,[Removed],[Removed],https://removed.com,,,
2024-11-29T23:08:15Z,independent,Independent,general,en,gb,,[Removed],[Removed],https://removed.com,,,
2024-11-29T22:14:29Z,independent,Independent,general,en,gb,,[Removed],[Removed],https://removed.com,,,
2024-11-29T21:59:49Z,independent,Independent,general,en,gb,,[Removed],[Removed],https://removed.com,,,
2024-11-29T18:40:42Z,independent,Independent,general,en,gb,,[Removed],[Removed],https://removed.com,,,
2024-11-29T18:29:16Z,independent,Independent,general,en,gb,,[Removed],[Removed],https://removed.com,,,
2024-11-29T16:24:02Z,independent,Independent,general,en,gb,,[Removed],[Removed],https://removed.com,,,
2024-11-29T15:23:38Z,independent,Independent,general,en,gb,,[Removed],[Removed],https://removed.com,,,
2024-11-29T12:04:05Z,independent,Independent,general,en,gb,,[Removed],[Removed],https://removed.com,,,
2024-11-29T11:03:31Z,independent,Independent,general,en,gb,,[Removed],[Removed],https://removed.com,,,
2024-11-30T01:22:19.5592997Z,la-gaceta,La Gaceta,general,es,ar,La Gaceta,El manager de Colapinto habló sobre el futuro del argentino: Tiene dos fines de semana para demostrar lo que vale,Todavía no hay ninguna confirmación con respecto al futuro del piloto pilarense.,https://www.lagaceta.com.ar/nota/1061907/deportes/manager-colapinto-hablo-sobre-futuro-argentino-tiene-dos-fines-semana-para-demostrar-lo-vale.html,,,
2024-11-30T00:37:24.6489673Z,la-gaceta,La Gaceta,general,es,ar,La Gaceta,La Libertad Avanza le respondió al PRO tras las críticas por la Ficha Limpia: Repugnante oportunismo,El oficialismo lanzó un fuerte comunicado después de que el partido de Macri volviera a exponer diferencias.,https://www.lagaceta.com.ar/nota/1061897/politica/libertad-avanza-le-respondio-al-pro-tras-criticas-ficha-limpia-repugnante-oportunismo.html,,,
2024-11-30T00:37:17.6819524Z,la-gaceta,La Gaceta,general,es,ar,La Gaceta,La jueza María Carolina Ballesteros dijo que su defensa llegará hasta por vía judicial,"A pesar de sus problemas de salud, la magistrada concurrió a la Legislatura para escuchar los fundamentos de su pedido de destitución.",https://www.lagaceta.com.ar/nota/1061899/politica/jueza-maria-carolina-ballesteros-dijo-defensa-llegara-hasta-via-judicial.html,,,
2024-11-29T23:52:33.2765856Z,la-gaceta,La Gaceta,general,es,ar,La Gaceta,"El Gobierno de Milei confirmó que en diciembre aumentarán la luz, el gas y los combustibles",Las subas quedarán en línea del porcentaje estimado de inflación o por debajo.,https://www.lagaceta.com.ar/nota/1061866/economia/gobierno-confirmo-diciembre-aumentaran-luz-gas-combustibles.html,,,
2024-11-29T23:52:29.3713071Z,la-gaceta,La Gaceta,general,es,ar,La Gaceta,Secuestro de mercadería: Gabriel Yedlin pidió que no se estigmatice a las organizaciones sociales,"“No hay que denostar el trabajo social que hacen las iglesias, las organizaciones,  las cocinas comunitarias, los movimientos, porque la inmensa mayoría le ponen muchísima dedicación; son honestos y fundamentales”, dijo el legislador.",https://www.lagaceta.com.ar/nota/1061888/politica/secuestro-mercaderia-gabriel-yedlin-pidio-no-se-estigmatice-organizaciones-sociales.html,,,
2024-11-29T23:52:23.4821488Z,la-gaceta,La Gaceta,general,es,ar,La Gaceta,Ficha Limpia: el PRO cruzó al Gobierno de Milei y lo acusó de jugar a favor de los corruptos,El espacio que lidera Mauricio Macri cuestionó al oficialismo tras la fallida sesión que iba a tratar el proyecto.,https://www.lagaceta.com.ar/nota/1061886/politica/ficha-limpia-pro-cruzo-al-gobierno-milei-lo-acuso-jugar-favor-corruptos.html,,,
2024-11-29T23:22:23.0477714Z,la-gaceta,La Gaceta,general,es,ar,La Gaceta,El quilombo está hecho hace 13 años: el audio del hermano del camionero que sacude el caso María Cash,Las escuchas telefónicas entre el hermano del camionero Héctor Romero y el hijo de su empleador revelan frases clave que complican aún más al principal imputado en el caso María Cash.,https://www.lagaceta.com.ar/nota/1061863/seguridad/quilombo-esta-hecho-hace-13-anos-audio-hermano-camionero-sacude-caso-maria-cash.html,,,
2024-11-29T22:07:25.6937138Z,la-gaceta,La Gaceta,general,es,ar,La Gaceta,Mercadería de Desarrollo Social: un testigo habló del reparto en elecciones,El posible uso electoral de comestibles destinados a personas en contexto vulnerable.,https://www.lagaceta.com.ar/nota/1061865/politica/mercaderia-desarrollo-social-testigo-hablo-reparto-elecciones.html,,,
2024-11-29T21:07:27.7869697Z,la-gaceta,La Gaceta,general,es,ar,La Gaceta,Fin del misterio: Atlético Tucumán ya definió la marca de indumentaria que lo vestirá en 2025,En las últimas horas los directivos del Decano llegaron a un acuerdo con una empresa italiana.,https://www.lagaceta.com.ar/nota/1061840/deportes/fin-misterio-atletico-tucuman-ya-definio-marca-indumentaria-lo-vestira-2025.html,,,
2024-11-29T18:07:23.6405775Z,la-gaceta,La Gaceta,general,es,ar,La Gaceta,Renunció el fiscal federal Carlos Brito y se abre otra vacante judicial,El ahora ex funcionario estuvo 38 años en su cargo.,https://www.lagaceta.com.ar/nota/1061849/politica/renuncio-fiscal-federal-carlos-brito-se-abre-otra-vacante-judicial.html,,,
2021-05-09T00:00:00Z,infobae,Infobae,general,es,ar,anónimo,El mensaje del Papa Francisco para Colombia tras casi dos semanas de estallido social,Colombia completa 12 días de marchas y protestas por el marco del Paro Nacional.,http://www.infobae.com/america/colombia/2021/05/09/el-mensaje-del-papa-francisco-para-colombia-tras-casi-dos-semanas-de-estallido-social/,,,
2021-05-08T00:00:00Z,infobae,Infobae,general,es,ar,anónimo,Violencia sin precedentes en Colombia: reporte oficial registra 548 desaparecidos y 26 fallecidos en 10 días de protestas,"El reporte dado a conocer por la entidad, con corte al 7 de mayo, también señaló que a la fecha 364 civiles y 41 miembros de la fuerza pública han salido heridos durante las protestas.",http://www.infobae.com/america/colombia/2021/05/08/violencia-sin-precedentes-en-colombia-reporte-oficial-registra-548-desaparecidos-y-26-fallecidos-en-10-dias-de-protestas/,,,
2021-05-08T00:00:00Z,infobae,Infobae,general,es,ar,anónimo,"“No podemos dejar que nos maten o que maten a civiles”, hablan policías heridos durante las protestas en Colombia",Algunos de los uniformados que resultaron heridos en las protestas contra el Gobierno se recuperan en centros hospitalarios.,http://www.infobae.com/america/colombia/2021/05/08/no-podemos-dejar-que-nos-maten-o-que-maten-a-civiles-hablan-policias-heridos-durante-las-protestas-en-colombia/,,,
2024-11-30T00:56:07+00:00,handelsblatt,Handelsblatt,business,de,de,,[Removed],[Removed],https://removed.com,,,
2024-11-29T23:18:05+00:00,handelsblatt,Handelsblatt,business,de,de,,[Removed],[Removed],https://removed.com,,,
2024-11-29T21:48:02+00:00,handelsblatt,Handelsblatt,business,de,de,,[Removed],[Removed],https://removed.com,,,
2024-11-29T21:26:06+00:00,handelsblatt,Handelsblatt,business,de,de,,[Removed],[Removed],https://removed.com,,,
2024-11-29T21:17:54+00:00,handelsblatt,Handelsblatt,business,de,de,,[Removed],[Removed],https://removed.com,,,
2024-11-29T19:32:19+00:00,handelsblatt,Handelsblatt,business,de,de,,[Removed],[Removed],https://removed.com,,,
2024-11-29T19:05:26+00:00,handelsblatt,Handelsblatt,business,de,de,,[Removed],[Removed],https://removed.com,,,
2024-11-29T18:57:05+00:00,handelsblatt,Handelsblatt,business,de,de,,[Removed],[Removed],https://removed.com,,,
2024-11-29T18:28:11+00:00,handelsblatt,Handelsblatt,business,de,de,,[Removed],[Removed],https://removed.com,,,
2024-11-29T18:02:58+00:00,handelsblatt,Handelsblatt,business,de,de,,[Removed],[Removed],https://removed.com,,,
2021-10-18T16:52:18.1226466Z,hacker-news,Hacker News,technology,en,us,Seth Michael Larson,Tests aren’t enough: Case study after adding type hints to urllib3,Since Python 3.5 was released in 2015 including PEP 484 and the typing module type hints have grown from a nice-to-have to an expectation for popular packages.  To fulfill this expectation our team...,https://sethmlarson.dev/blog/2021-10-18/tests-arent-enough-case-study-after-adding-types-to-urllib3,,,
2021-10-18T16:37:20.4140551Z,hacker-news,Hacker News,technology,en,us,,bigscience/T0pp · Hugging Face,We’re on a journey to advance and democratize artificial intelligence through open source and open science.,https://huggingface.co/bigscience/T0pp,,,
2021-10-18T16:22:22.7051218Z,hacker-news,Hacker News,technology,en,us,,Sequoia PGP is now LGPL 2.0+,Sequoia is a modular OpenPGP implementation in Rust.,https://sequoia-pgp.org/blog/2021/10/18/202110-sequoia-pgp-is-now-lgpl-2.0/,,,
2021-10-18T16:07:22.2869802Z,hacker-news,Hacker News,technology,en,us,,Code CAD – Use code to create CAD models,"A community hub for CodeCAD parts, OpenSCAD, CadQuery, JSCAD and more",https://cadhub.xyz/u/caterpillar/moving_fish/ide,,,
2021-10-18T16:07:20.4749314Z,hacker-news,Hacker News,technology,en,us,,Opening up a physics simulator for robotics,"As part of DeepMind's mission of advancing science, we have acquired the MuJoCo physics simulator and are making it freely available for everyone, to support research everywhere.",https://deepmind.com/blog/announcements/mujoco,,,
2021-10-18T15:52:19.7371635Z,hacker-news,Hacker News,technology,en,us,,My Framework for Building Side Projects as a Solo Developer – Rauno Metsa,"When you work full-time, it's certain that you'll get paid.
When you freelance, it's almost certain that you'll get paid.
When you start a side project, it's uncertain if you'll ever get paid.

And this can make it hard to start a side project. But what if yo…",https://raumet.com/framework,,,
2021-10-18T15:07:21.436149Z,hacker-news,Hacker News,technology,en,us,Arthur O’Dwyer,What =delete means,"In my C++ training classes, I often explain the meaning of =delete as


  The library author is saying, “I know what you’re trying to do,
and what you’re trying to do is wrong.”",https://quuxplusone.github.io/blog/2021/10/17/equals-delete-means/,,,
2021-10-18T13:07:05.7613279Z,hacker-news,Hacker News,technology,en,us,,How PHP Opcache Works,,https://www.npopov.com/2021/10/13/How-opcache-works.html,,,
2021-10-18T12:52:05.7468837Z,hacker-news,Hacker News,technology,en,us,,What to Learn,,https://danluu.com/learn-what/,,,
2021-10-18T12:22:18.6165958Z,hacker-news,Hacker News,technology,en,us,,Eating the Cloud from Outside In ∊ swyx.io,AWS is playing Chess. Cloudflare is playing Go.,https://www.swyx.io/cloudflare-go/,,,
2024-11-29T14:32:08+00:00,gruenderszene,Gruenderszene,technology,de,de,,Headhunter: So bereitet ihr das Gespräch vor,"Was muss man tun, damit ein Headhunter anruft? Worauf achtet der beim ersten Gespräch? Ultimative Tipps für den Umgang mit Headhuntern",https://www.businessinsider.de/gruenderszene/karriere-startup/headhunter-das-solltet-ihr-bei-headhuntern-vermeiden-so-bereitet-ihr-euch-vor/,,,
2024-11-29T14:05:05+00:00,gruenderszene,Gruenderszene,technology,de,de,,DHDL-Rückkehr: Frank Thelen ab Herbst 2025 wieder in der Jury,"Der Alt-Löwe wird wieder in der Startup-Castingshow dabei sein. Gleichzeitig verlassen Tillman Schulz, Nils Glagau und Tijen Onaran die Jury.",https://www.businessinsider.de/gruenderszene/media/dhdl-rueckkehr-frank-thelen-ab-herbst-2025-wieder-jury-upd/,,,
2024-11-29T12:56:19+00:00,gruenderszene,Gruenderszene,technology,de,de,,SEO und KI: Diese Prompts müsst ihr für mehr Sichtbarkeit nutzen,"SEO-Tools helfen schon lange dabei, Websites auf Google sichtbarer zu machen. Mit KI ergeben sich nun neue Potenziale. Hier sind 20 Befehle.",https://www.businessinsider.de/gruenderszene/technologie/seo-ki-20-konkrete-chatbot-prompts-durch-die-ihr-besser-auf-google-gefunden-werdet-bfr/,,,
2024-11-29T12:49:39+00:00,gruenderszene,Gruenderszene,technology,de,de,,ESOP 2.0 – So spart ein Startup seinen Mitarbeitern hohe Steuern,ESOP und VSOP bieten einige Tücken und sind teilweise mit hohen Kosten verbunden. Das Fintech Billie hat sich dafür eine Lösung einfallen lassen.,https://www.businessinsider.de/gruenderszene/karriere-startup/esop-2-0-so-erspart-ein-startup-seinen-mitarbeitern-hohe-steuern-bfr/,,,
2024-11-29T11:27:37+00:00,gruenderszene,Gruenderszene,technology,de,de,,Börsen-Krimi um Creditshelf: Wie böse ein Startup-IPO enden kann,"Ringen um die letzten Reste: Wie brutal Startups am Börsengang scheitern können, zeigt das Fintech Creditshelf – unsere Reporterin war dabei.",https://www.businessinsider.de/gruenderszene/business/wie-brutal-startup-traeume-an-der-boerse-platzen-investoren-krimi-bei-fintech-creditshelf-bfr/,,,
2024-11-29T11:25:33+00:00,gruenderszene,Gruenderszene,technology,de,de,,Vom Boom zur Pleite? Warum gleich 3 Camper-Startups Insolvenz melden,"Binnen weniger Tage haben Off, ehemals Camper Boys, Plugvan und Roadfans Insolvenz angemeldet. Was ist da los?",https://www.businessinsider.de/gruenderszene/business/vom-boom-zur-pleite-warum-gleich-3-camper-startups-insolvenz-melden-bfr/,,,
2024-11-29T10:17:57+00:00,gruenderszene,Gruenderszene,technology,de,de,,Unhappy Ending: Sind Exits nicht das Maß aller Startup-Dinge?,"Was, wenn der Exit die falsche Entscheidung ist? Und: Gibt es denn überhaupt Alternativen? Wir schauen uns zwei Fälle an.",https://www.businessinsider.de/gruenderszene/perspektive/unhappy-ending-sind-exits-nicht-das-mass-aller-startup-dinge/,,,
2024-11-29T08:56:39+00:00,gruenderszene,Gruenderszene,technology,de,de,,"C-Level-Job im Startup? Gründerin verrät, worauf sie achtet","Von Talentsuche bis Onboarding: Femtasy-Gründerin Julie Lepique verrät, wie sie vorgegangen ist und welche Fragen sie gestellt hat.",https://www.businessinsider.de/gruenderszene/business/c-level-job-im-startup-gruenderin-verraet-worauf-sie-achtet-fdr/,,,
2024-11-29T07:00:24+00:00,gruenderszene,Gruenderszene,technology,de,de,,Steuerexpertin erklärt: So geht die Einbringung von Anteilen,"Wer Anteile des eigenen Unternehmens verkaufen will, sollte eine Holding gründen. Was dabei zu beachten ist.",https://www.businessinsider.de/gruenderszene/perspektive/steuerexpertin-erklaert-gmbh-anteile-in-holding-reinbringen/,,,
2024-11-29T06:07:54+00:00,gruenderszene,Gruenderszene,technology,de,de,,Lieferdienst: Ex-Deliveroo-Fahrer über Gehalt und Diskriminierung,Er lieferte Essen auf dem Fahrrad aus und gründete den ersten Betriebsrat für Rider. Orry Mittenmayer spricht über Foodora und Deliveroo.,https://www.businessinsider.de/gruenderszene/business/lieferdienst-ex-deliveroo-fahrer-ueber-gehalt-und-diskriminierung/,,,
2024-11-30T01:01:09Z,goteborgs-posten,Göteborgs-Posten,general,sv,se,Joakim Hulterström,Misstänkt grov våldtäkt i Gårdsten – fyra gripna,"Fyra män har gripits misstänkta för grov våldtäkt i Gårdsten. <br/>Enligt polisen rör det sig om två offer, men skadeläget är oklart.",http://www.gp.se/krim/misstankt-grov-valdtakt-i-gardsten-fyra-gripna.ec01b030-61b7-44a2-b65f-bb04e46fd0d4,,,
2024-11-29T21:56:37Z,goteborgs-posten,Göteborgs-Posten,general,sv,se,Teo Kristjansson,Larm om brand på Estrellas chipsfabrik i Angered,Läckande varm olja orsakade stort räddningspådrag.,http://www.gp.se/nyheter/goteborg/larm-om-brand-pa-estrellas-chipsfabrik-i-angered.52cc03ea-6f65-4c23-86ac-60027045c562,,,
2024-11-29T21:11:38Z,goteborgs-posten,Göteborgs-Posten,general,sv,se,"Philippa Fransson, Maria Blanco",Zelenskyj: Vapenvila mot Natoinbjudan,Öppnar för vapenvila utan att Ryssland behöver lämna Ukraina.,http://www.gp.se/nyheter/varlden/zelenskyj-vapenvila-mot-natoinbjudan.a82eb794-bc0e-45b3-91f7-314ae7f9f5b8,,,
2024-11-29T20:04:16Z,goteborgs-posten,Göteborgs-Posten,general,sv,se,Andreas Johnsson,Efter kaoset – Utsiktens starke man Ingemar Lundin slutar,Det har stormat kring Utsiktens BK och så sent som under fredagen löste man elitlicensen och räddades därmed från tvångsnedflyttning. <br/>Nu meddelar klubben att mångårige ordföranden Björn Jarkvist lämnar klubben – samtidigt som även Utsiktens starke man In…,http://www.gp.se/sport/fotboll/utsikten-bks-starke-man-ingemar-lundin-slutar.eaa8d4e6-b093-4139-b0c1-889d49fa5a1d,,,
2024-11-29T20:00:00Z,goteborgs-posten,Göteborgs-Posten,general,sv,se,Johan Lindqvist,Recension: Vinna eller försvinna för humorduon i ”På spåret”,Hanna Dorsin och Emma Molin behövde besegra Apelgrens för att stanna i tävlingen.,http://www.gp.se/kultur/recension-pa-sparet-svt-del-5-2024.832abf38-ec49-4fc0-8c0b-92ec1d3c00d1,,,
2024-11-29T14:58:37Z,goteborgs-posten,Göteborgs-Posten,general,sv,se,Felix Tornberg,Christian föll från 20 meter: ”Varför sa vi inte hejdå?”,"Hustrun Elin lämnades med barnen, tankarna och en dagbok.",http://www.gp.se/livsstil/elin-skrev-dagbok-medan-christian-kampade-for-sitt-liv.25fcba58-6a62-401e-9dda-d6da6787bb8b,,,
2024-11-29T04:52:25.1819623Z,goteborgs-posten,Göteborgs-Posten,general,sv,se,,Här flockas kändisarna – i grindsamhället utan grindar,,http://www.gp.se/ekonomi/folj-med-in-i-hills-villastad-grindsamhallet-utan-grindar.1c6254df-e8ea-4d79-844f-33f801bad1b4,,,
2024-11-07T23:22:27.5005781Z,goteborgs-posten,Göteborgs-Posten,general,sv,se,,Senaste nytt,Senaste nytt från Göteborgs-Posten på gp.se. Riktig journalistik gör skillnad.,https://www.gp.se/nyheter/senaste-nytt,,,
2024-10-19T03:58:56Z,goteborgs-posten,Göteborgs-Posten,general,sv,se,Etezaz Yousuf,Finansministern: Måste löna sig att tjäna 125 000 i månaden,Elisabeth Svantesson (M) om avskaffat amorteringskrav: ”Blir det allt eller inget?”.,http://www.gp.se/politik/finansministern-maste-lona-sig-att-tjana-125-000-i-manaden-.47c941b3-c827-4c73-bd98-5b5d1ba34678,,,
2023-08-01T08:12:00Z,goteborgs-posten,Göteborgs-Posten,general,sv,se,,Lyssna på GP Dokumentär,GP Dokumentär tar med dig bakom rubrikerna. Till historierna och platserna där det verkligen hände – med ämnen som berör och engagerar. Berättade av Göteborgs-Postens reportrar.,http://www.gp.se/poddar/gp-dokumentar.8f1980f4-e199-4b4b-b3cc-fcfbe7b96a0a,,,
2024-11-30T01:05:14+00:00,google-news-uk,Google News (UK),general,en,gb,,Google News,"Comprehensive up-to-date news coverage, aggregated from sources all over the world by Google News.",https://news.google.com/rss/articles/CBMiXEFVX3lxTFBPUzBFNzJDQm52bVREMm9mSF8yVG01R2pvYXczM094c1diZE9JVkdDU2dqTTRNU0hmZ0tTYnBTZlhELUJ0aU5CbmdvWmVGcDJmT2NLUThweHFIdkFW0gFiQVVfeXFMUDBBS0V4Mkdkc1dhVnFTOENqcFRXM1U1bmhsbFpteHY0bVA4TkdpcmJodFVSWHVpbmxTdFBXTFVBMEY5TDhXVmVWelpjaHBqa2xzd1Jvb2p4TFEzay10aUwyQUE,,,
2024-11-30T00:16:06+00:00,google-news-uk,Google News (UK),general,en,gb,,Google News,"Comprehensive up-to-date news coverage, aggregated from sources all over the world by Google News.",https://news.google.com/rss/articles/CBMicEFVX3lxTE15UmE3Ny03a2pSMlVsejkzZTRLc3N2VlZEa0NxTTQySDFveXRyZlN4MzJpZGNJV1F4aUxibkVQV2VZMDJzUndwQi16V3pFZnp0ODFkQzN1aGhXWDdBeGZTdnJGV0xqaWp4dUpwT3RkZmw,,,
2024-11-29T23:44:00+00:00,google-news-uk,Google News (UK),general,en,gb,,Google News,"Comprehensive up-to-date news coverage, aggregated from sources all over the world by Google News.",https://news.google.com/rss/articles/CBMitwFBVV95cUxNN0ZuRGxXOUtaVGlBRHpOblRSb19UamFaMEJNOHR4OE5mY0lGeVRlMHE2MGQ0amEwVDJ1TDZHRjZfdl9TZHBQSmJ6OHlrcW9vblhMZTRuQmZ3bEp6YTU2V0RoX1BUdzBELWhxZmtSdWQtMmtkYVlDWS1VREFVLTN2aXJxS0JrQ0RmWVpzdmhReUNaeE9xdTVLclZScWxYSVhjRTUzVVFpdXFjZWgxOFBZcFhhUFNaWU3SAbcBQVVfeXFMTmpTYXNYVC1vU19rYXRrUTNycXdIOFUycHd6N3hnNllfTWFEZ3M3RzdsTzByY1RZaHRxM3JUS1hBRXUzcU5EOUR3WTF3aHlJaVEyNkpoTERwWjZaNGRxV0tMdWxfZTRqZDhTNDAyQ3BjTjIzMlY1ZXA0c29oQjRtZXItem91S250VHBhVm9ySDdSTGhlVk9lWjJjNTdCMjJidHFhcS02OThEWVpLSFY3azJYOV9RZVNF,,,
2024-11-29T23:21:00+00:00,google-news-uk,Google News (UK),general,en,gb,,Google News,"Comprehensive up-to-date news coverage, aggregated from sources all over the world by Google News.",https://news.google.com/rss/articles/CBMilwFBVV95cUxPWURqYVVKOVNzUHlaR05saFMxYlVmWkl3cm1tMFlGYTduNm1YY3FLNTN2R2xtNFRwemt0XzluNlFleU9FTFYwSDNvRkUtVExHVG1nVl96LXBCaUdIVVZkWmNaTU13V3Y4WmNqcWZFXy1UUnVYVDdnSjZXcTZUa18wTHZwc0x0eTNsYWF5RkMtbEE2QVRaeXZz0gGcAUFVX3lxTE9lMjVkeUZwUWlqeGFPaS0za0l0UHN0Z3MzaXE5Z3FCdUYzMm9uN3luMlBHV1Q1LTN4Z0x1UkppQXBPSllXVnRuYS1tU3pEQW15cXRfb3BlTlRpOXczQUZXc0VrQWtoQkpxQlpwM2FBRy13QlB3QU1JX3QwMk5hN2pvMXRUNWQ4M2pyN25ucmlURW5sbzctVHJ3RGo4eQ,,,
2024-11-29T21:00:00+00:00,google-news-uk,Google News (UK),general,en,gb,,Google News,"Comprehensive up-to-date news coverage, aggregated from sources all over the world by Google News.",https://news.google.com/rss/articles/CBMi7AFBVV95cUxQVVhKSmJjdGlEd212dXlFTUdRNnRhRjBtMGFQWjRVaDZwVjM5WFFQT1dqNzB1eklKOTZmZXpNdXRZREQzVXpOdG9CcGdHN183RGhnMjQxaHQ1bFZnRU5sT05CR3l4SU9aempGeGduREFUaEhaT0k0Sy1FTzRYS25xTmxZRjczZm5SdnhHT3hYMWZvQUN4NTdOV1lBdXRNLUxiZW8wemxlM2xsWmVUdXpPeGh0NHJLUjRYU3Vfa0Iwcm9FdEY5OGN3THItelhnNmhUaWxHeGRJYlpNdXVaak5sWFBPNnAtTy1rWGNwLdIB8gFBVV95cUxOdTlaZnkwU1Q4WFFua0xKVHFScHVIZWFBSlJDQmtCckJiYUQ2ZkZ1ZGNhLTV0XzJubTg4NmViYnpJNndlcWNVUkFiMDFTSEdwdDlJSW5VdlZGR1VfYVZtaWhLTnAyUmFOOURhdHgwaXlBRGNrckhick9oVHJ1cF9BTVdGMnA1NmRMTGZueXVjT1JRMWNSX0ZOckpfX2tvVVhFRlA0Zlo1N0p3N3FrLTFlQ1NCVWxBcFRCcExsbnVjNmh2Zmx4LWtYREw3TWFBUVpHZkl5X3I3ZDlDOXVOeEdPbG8yU0ZYcFF2VWMxaF9qa0RJdw,,,
2024-11-29T19:55:00+00:00,google-news-uk,Google News (UK),general,en,gb,,Google News,"Comprehensive up-to-date news coverage, aggregated from sources all over the world by Google News.",https://news.google.com/rss/articles/CBMirgFBVV95cUxObkhQbW5hWnpQRERCTTNTUDBBbjQ4NEtFaF9HMXQwcVJrYzJ3ckdLb2p1R0o2Ujk5NTBvY0tieXJXSENVeEl1N0pUUXU1cEppd2g4Vl9HdWtlUGVUWFhuWEN2clgtdk14bkpoLWhoclphb1JMQ1BxN3FDd2JqYWcwQjVDYzdqMUdNRnVRaWRJcDlOS2FwXzNqbHFzVXlLUWpZSjB3c2NQWG1pZkhIb3c,,,
2024-11-29T15:05:54+00:00,google-news-uk,Google News (UK),general,en,gb,,Google News,"Comprehensive up-to-date news coverage, aggregated from sources all over the world by Google News.",https://news.google.com/rss/articles/CBMiXEFVX3lxTFBqczlQN3BBZkpxNHl2d1BpSElfTnBCZHZ6ZVg3R1o0ZWFHM25naDdWelBmZi1MN2kyMXVDVlBkVnowUTVBc01TU2tkLUdzVTJabVhOVWRrZDBBcWE1,,,
2024-11-29T14:30:29+00:00,google-news-uk,Google News (UK),general,en,gb,,Google News,"Comprehensive up-to-date news coverage, aggregated from sources all over the world by Google News.",https://news.google.com/rss/articles/CBMivwFBVV95cUxNcVkzREpGLW12bE84MlhLVFk3MnpRdTJBNGE5OGI1RTY2SDlqbVBTNTJvSFdLM05LT1UtS29hNndCS2lKVkdtVzFZT1FKR3pfaFM1N2Nvb0lOT2d5eUxDbFoxY0tCdTd5RVJBUlJkbnhIa1gwUW1oVHBFLWNvZ0lpS2V4ZGhfSEE0YlYxMjdMX3JZeUJBMjh3UDdtenpRMDlLSDdQdlNodDM1aGhqNS1tSXNxcWc0dDljTlVMa1Axb9IBvwFBVV95cUxNdUZEMkFfSGtXT0IyTkF5OW5Ic1FobVQyUEpyenJUMURlSXFiVlBWYkJ5UTQ0MkpoRzZ4RGtLVEhWYWxENXdPLVMzTGxmeWZUM2plTDZBVW45STFGMXhneHZia3VQTk5ISlpvOVh3MmxPaXhXV2FHZENzZ0hmdFZHRkRLSUt3Q2FLbTlpVXVhZXYxOEQ4aklQaDhONW9TcHk0WW1WWkUwbVRjdFNHa0JUYmF5QWhhS2JRa0VFNkpnWQ,,,
2024-11-29T13:05:39+00:00,google-news-uk,Google News (UK),general,en,gb,,Google News,"Comprehensive up-to-date news coverage, aggregated from sources all over the world by Google News.",https://news.google.com/rss/articles/CBMiXEFVX3lxTE9WSzBnMkZ4ckhJVVl1WkFnN09ZT0VhZThxWG4yUzMwcDdqYXFyNHYzSFVtTF9mTW1TaUVaTjAxdnE5Q2taMno2R1QtaDNxN2hGeUc0d2VVN3pIZkZt0gFiQVVfeXFMTm12dGhSSVo2cW9TZzVsQmZEZ0JiMFhPbS1CcG0za0twTTJKd05ZUnZXMmVTbUh1U3lrYm01eVUxUnJsY2VGSDc4YnRTaFVUOUVlcmZKS1ZodHVOSzN3NmJRSVE,,,
2024-11-29T12:02:20+00:00,google-news-uk,Google News (UK),general,en,gb,,Google News,"Comprehensive up-to-date news coverage, aggregated from sources all over the world by Google News.",https://news.google.com/rss/articles/CBMitgFBVV95cUxNTDQ2LWhzc05ISFZhR0tpRWczX2syc1U2N0ItY19wUDN2QkhjMmFaYjl1TUhITXhPZlVKSlBpeTNJTl9JT2FKc052ZzVHUzB4eHY5ODljLTZsam1OVk5aTkI4N2NtUV80LW1DZkZyZDB1bjhzZV96Nk40ZFY3UUZIM043SFI5Z0haWHRhSDVtbnhoTV8teWJGZ2lxaGxFaWJpUlBXbm43RXFrS2VoandZbjJpbFRGUdIBuwFBVV95cUxNVk0zUDdpbjFGYjZXUi1GUjdtc181UTE0eVpYd2w4bU51Y3hTcHA2WFQwSnNRZlMxYWlZWHFuRWFsaTVxRnRrWFVMaTRPNENUWXk3U2ZrQXB2Ql95YUF3QkN4LTVHc1FfRE85Mk9XSF9ZQlM1bUpUNXpFNW5YYnFBR3hoZUxUWkdHUjVOSGZtX1NaZTBpQWFscHRIYW5MUERmcTRjcnpwZHpMbHNOck9NRnY0aEdXa3A4dVo4,,,
2024-11-29T22:53:00+00:00,google-news-sa,Google News (Saudi Arabia),general,ar,sa,,Google News,"Comprehensive up-to-date news coverage, aggregated from sources all over the world by Google News.",https://news.google.com/rss/articles/CBMiX0FVX3lxTE5RbEdITENqX1BrSUp1dkd2YU1lMkFsSlpqcUJNQmhHN3Y4NlZfeWRkLU1HQV91S25WMDlBWUdlXzZ0cmVYRTNKUDJ0U0FieFVUNlcyTFpvQTVZVVozNTlV,,,
